,comment_id,text,author,upvotes,timestamp,post_id,lens
6030,hdqpq4n,tisztel mzp forgatókönyv eset ellenze parlament többség szándékoz megszólítan vide katéterezet idős fideszes demográf választás jövő kapcsolódó gondol begyógyítan politikaikulturális szakade tapasztalható ország utóbb kormány hagyta ésvagy önös érdekből foglalkozt trianon határ magyarság diaszpór terv felkarolás támogás megvédés neonác erdélyi szisztematikus romanizáció hajlandó megvonn egyház adómentesség elítéln katolikus egyház jehov tanú pedofil megvonn gyülekezet történelm egyház státusz,Pontivs_Navghtylvs,106,1632245277,psmizh,57
6035,hdqn31b,kedves péter kérdés tekintv aktív képviselő leszel képes kormányozn anél túlságos párt tartozó képviselő akarat kormányzás konkr lépés érne igazságszolgáltatás függetlenség helyreállítás akadályozna jövő lehess leépítan kapcsolódó konkr lépés függetlenség helyreállítás jövőbel biztosítás kiegészítv bónusz kérdés képzel alaptörvény érvénytelenítés anél veszélyes precedens teremt nézvés válasz siker forduló,Gomdzsabbar,74,1632244194,psmizh,47
6043,hdql7xm,foglalkoz ellenze jobb közbiztonság kérdés fidesz tetszeleg rendpártiság szerepkör ellenze jelöl érthetetl kerül jobboldal jelölt profil vágn szavazó hozn elmúl felháborító erőszakos járat közismer fegyencjárat főváros köztér erőszakos kéregető vegzálja járókelő néhol könnyebb dizájnerdrog venn kiló kenyer karácsony osztogat utazás kedvezmény inzultus félv kiszálln autó duzzasztja dugó vidékről szólt beszéln problém kihagyot ziccer,sajnalom,54,1632243433,psmizh,53
6054,hdqn7ob,tisztel polgármester említett jobboldal keresztény érték vall magá ismeret különös érdekeln fontos látja esetleges kormány orbánkormány katolikus egyház átjátszot közvagy elvesztegetés szabj gondol eset esztergom esztergombudapest főegyházmegy tulajdon adás vonatkozó terv egyház összefonódás megakadályozz szétválasztás elősegíts etikus tart magyarország keresztény ország definiálja azonos nemű házasság gyermeknevelés hivatkozv csorbítja törvényhozó,pxyvqr74,17,1632244247,psmizh,49
6058,hdr5gbu,atvs direkt megszolitott balos szavaz oldal alapj igazgatosag kozot teolog foglalkoz csal kisgyer kampany resz elohoz konzervativ ertek egesz pontos tudsz ajanlan fiatal feltetl szulogepken haziasszonyken tervez leeln elet lehetoseg fogsz biztositan tudj szoln orszag tarsadalm gazdasag elet eddig uzenet alapj ugyanaz szerepel nalat fidesznel igaz vonz typo,elohasiuszo,8,1632251795,psmizh,48
6063,hdr2i1b,kedves péter vallás szekularizáció fidesz markáns csökkentett vallás különválás nyer kultú szociális ellátórendszer oktatás szint szám rendkív aggasztó vallásos ember egyfelől vallás felekezet önkény függőség rendszer kényszerítv másfelől lakosság rákényszer vallás szervez fenntartot iskol járass gyer hangsúlyozt fontos keresztény részemről természetes kérdés határozz vallás kapcsolat helyezked lakosság vallásos rész,Vitruvius_Corvinus,3,1632250572,psmizh,49
6068,hdrb6zm,tisztel mzp legjobb tudomás magyar ösztöndíj nyúj hallgató összeg budapest viszonylat éhenhaln vide szegényes életvitel fenntartan mindemellet elmúl tudománypoliti fejlemény fény magyarország akadémi karrier fény meglepő fiatalabb generáció értelmiség réteg egyetem berk képzel jövő jellemző erős maradn ország kérdés amenny megnyern minisztereln választás ellenze összefogás alakítan kormány tenn magyar tudomány veszíts színvonal megmaradj tudomány művelő utánpótlás,duckinanddodgin92,3,1632254136,psmizh,56
6069,hdqna2g,tisztel mzp vélemény honvédség szerepéről felügyeletéről fidesz utóbb végrehajtot fejlesztéseiről haditechni beszerzés zríny progr elvárás megfelelés tenn ország versenyképesség fejlődj összeszerelő legy terület fejleszten politikus ország cselekedet lehet magyarország politi kultú uszítás együttműködésről szól lehet szigorú civil szakértő kormány választana történn fiatal otthonteremtés támogatás babaváró hitel remél megélhetés politikus vezet jövőbenjövő ország siker,bnboci,14,1632244273,psmizh,53
6075,hdqsi6v,konzervatív jobboldal polit képvisel mozgalm magyarország mozgal jelen képes minisztereln ember megszólítan centru kapitalizmus ellenes kiáll lmbtq mozgal radikálisabb téma drogfogyasztás dekriminalizalas hajlandó vélemény vita gyermekes képzel gyer akaró fiatal támogatás gondol magyarország leváltás ország globális esemény hatás klímaválság társadalm egyenlőtlenségekbol fakadó szakadék kitagulas,Calildur,9,1632246433,psmizh,44
6076,hdqnliv,tisztel polgármester kérdés változtatna jelenleg európ szint szigorú kormányrendelet fegyvertartástviselés illető megengedhető fegyvertartás vadász spor önvédel vagyontárgy védelm gondol felfegyverzet nemzet nehezebb belső külső elnyomó uralm vetn jelenleg rendelkezés indokolatlan szigorú erőszakos bűnözés mérte környező ország segí rendőrség szemben jogtal bizalmatlanság vélemény cseh mint észszerű kompromisszu személyes szabadságjog biztonság kíváncs vélemény különös összefogás párt beszél válasz,kristofcsa,8,1632244406,psmizh,56
6080,hdqske8,tisztel mzp szeretne feltenn specifikus szív álló kérdés interjú nézéséből kapt válasz álláspont kereszténység támogatás kapcsolat megfordítható hívő szám csökkenés egyáltal feladat irány fejleszten ország közlekedés infrastruktúrá kapcsolat közlekedés eszköz tart kulcsfontosságú megválasztana paks atomerőmű paks sors szívből remél magyarország következő minisztereln,fajank0,7,1632246459,psmizh,42
6099,hdrqs2j,kedves péter úgyérz értekrendileg agnoszticist balliberális kereszténykonzervatív legtávolabb minisztereln jelöl jelölt amenny megválasztja ugyanúgy tamogatna eseeges miniszterelnökseg eset menny fontos kereszténykonzervatív értekrend alapj kormányozz közélet társadalm melegházasság kisebbség védelm gazdaság többkulcsos adórendszer többlépcsős nyugdíjrendszer kérdés jelöl alapvető öntöl gazdaságilag minden társadalmilag valószínűleg balabb helyzked nézn együttműködés,Zerasad,2,1632260733,psmizh,46
6103,hdqodq7,szándékoz biztosítan minisztereln átvizsgáljafelfüggesztiújraköt titkos orosz szerződés siker magyarország figyel újrakötn felmondan lemond minisztereln székéről haladéktalan örömö szolgál külföld tartózkodás betekintés nyer külföld oktatás egészségügy gyakorlat szeretne nyakló átvenne kérdés tényleges látsz szakm fórum megtartás külföld hiteles szakemberekkel  fogja támogatn kormány tervez esélyegyenlőség progr nyilvánosság hozás hajlandó népszerűsíten elterjeszten szakpoliti vita megfelelő nyomor kiemelő program igazgyöngy alapítvány képvisel,csdybl,7,1632244728,psmizh,58
6106,hdqqgmt,kedves mzp vélemény kisebb fidesz összellenze kívül párt kdnp haza iszom intézkedés hoznatámogatn külhon magyar helyzet megsegítés segíten székely autonóm törekvés kormányállamforma megtartaná parlamentáris köztársaság esetleg támogatna elnökialeln brazíl rendszer átváltás esetleg monarch visszaállítás személyes kérdés vélemény internetes kultúr videójáték redd,AdamsDetectiveAgency,7,1632245585,psmizh,41
6108,hdqrxm6,tisztel márkizay péter kérdés elképzelés talál valu gondol kanad rosszabb csinál magyarország •amenny alakítan kormány tudja képzeln mostan fideszes tisztségviselő tovább betölts valamily szerep vitézy állított kormányváltás eset rész vehetn budapest közlekedés szervezés szakember tart gyurcsány ferenc közös ellenze list •kormányváltás eset kormány elérn fidesz jöjj válasz siker kíván előválasztás,HighGrounder_420,3,1632246196,psmizh,50
6112,hdqvnll,tisztel péter magyar oktatás helyzetéről beszél legtöbbször tanár hiány alulfizetettség említ való fontos kérdés rengeteg problém tanterv túlzott lexikális tudás fókuszál logikus gondolkodássalgyakorlat tudás hangsúly irodal tantárgy mond matemat informat reál tantárgy élet elengedhetetl dolg elsősegély adózás pénz általánosság tanul gimnázium középiskola végzős gimis média utóbb film nézt abszolú szükségtel szeretne kérdezn vélemény minisztereln változtatna tanul diák fejleszten oktatás,yaboiDanimal,4,1632247739,psmizh,59
6113,hdqz2k1,tisztel polgármester elöljáró anny konzervatív fiatal legszimpatikusabb jelöl előválasztás habár tervez szavazn kérdés vegy támadólag konzervatív jelentős gondolataiterv baloldal kihívó főleg szociális egyéb gazdaság kérdés konzervatív politikus baloldali tetszv politizál remélhetőleg megválasztó jobboldal kics párt bejáratot politikus kormány baloldal összefogás túsz esetleg választás kígyó kígyózza válasz,ofcourseimatroll,3,1632249145,psmizh,46
6126,hdquss0,kedves péter specifikusabb szám egyénileg fontos kérdés választott fontos tartja vallás állam intézmény szétválasztás lépés tenn körűbb elérés fontos tartja titkosítás polgár álltal elérhetőség menny támogatna titkosítás visszafogás szolgáltató üzenetküldő közösség gyermekpornográf terjesztés terrorizmus meggátlás hivatkozv lehetséges kormányváltás eset gyors törvényhozás stratég alkalmazn megfontoltabb elnyújtottabb megközelítés választan estleg mindkettő menny támogatn országos informati korszerűsítés progr szerverinfrastruktúra kiberbiztonság kormányoldal webdizán foglaln,Critical_Net_7876,2,1632247383,psmizh,60
6132,hdr3u8c,tisztel mzp magyar polit fidesz hajl legszimpatikusabb ellenze jelöl győzni érdemes átváltan euró magyarország kormány jutás eset meglévő családtámogatás program csok babaváró hitel folytatna esetleg kissebb mértékű támogatás adna lakásár csökkentés tenn csökkents lakásár támogatna fiatal kikerült iskol egyet pénz egyet elhagyta nincs körülmény lakásvásárlás tanár fizetés növelné menny jelenleg kormányintézkedés folytatn támog válasz,kgergely_HUN,2,1632251127,psmizh,54
6142,hdqrxi0,tisztel mzp pestmegy választókerület érdeklődnékdunakesz racionális belátható ment döntött jelöl jelöl álltkarácsony gergely korább alpolgármest dorosz kiemel gazdaság övezet nevezet samsung gyár önjáró fidesz vörös szőnyeg mellékel érzékeny terül esetleges kormányváltás samsung tapasztal politikus bízna jelölt tart alkalmasnakmás szempont szavazne,Broad-Associate6635,2,1632246194,psmizh,40
6146,hdquime,tisztel mzp gyors kérdés kapitalizmus kritikus világ jelenleg világ probléma mindenhol vezetn üzlet érdek előtér helyezés klímaváltozás közelkelet háború ember történő kizsigerelés ellen nyilatkozat megoldás rendszer ellentét feloldan megoldás piacgazdaság rovás menn mond ökológi katasztrof visszaforditan fajt gyűlöl hulla társadal hely felutott politi idegengyűlöl homofob transzfob egyszerű vakcin ellenség kapne válasz szavazat kierdemelt eddig kiállás,wiozan,1,1632247264,psmizh,55
6151,hdqu2d6,kíván kérdés sikerüln kormány kerüln hozzányúln földtörvény gazdálkodó könnyeb juss feltétl haladna környe árulna megtermel életvitel szerű tany tervez hivatalos egyszerűb tétel gondol olyan személy szám szám azonosító kiváltás szám hatszáz papír kitölten igénylés adat egyéb rögzítv egyéb igazoln dokumentum helyszín,kisbalazs,1,1632247077,psmizh,41
6162,hdqw9f6,tisztel miniszterelnökjelöl fiatal magyarország érdem képviselet tényleges jobb oldal érték fiatal meglepet ország politikus átlagos facebo instagr közösség oldal érdeklőd szavazó redd behúzt kövér nézt ahogy partiz vitá felmoss padló mucs tamás esetleg láthat választás miskolc generáció humor készített szereplés,AnusHunterWarrior,1,1632247991,psmizh,40
6165,hdqzbkx,kedves péter valószínűleg releváns dolg ellőtt többi progr támogatásról jelöl ápol viszony előválasztás stratég kérdezz személyesebb kampány kapcsolódó tudh energ magá kampány alkal látt hallott asztal egyszer egyszerű felfogn képes mindez átutazottátszerepel legvég korrekt színvonalas lehozn televíziós ötös látt valamenny,bpo106,1,1632249251,psmizh,40
6170,hdqs532,tisztel polgármester politi tartalm aktív fogyasztó prof közvéleménykutatás részesít előny karácsony dobrev helyez elsőmásod hely zshow friss felmérés szavazt szerzet ideológia tárház felmérés résztvevő szavazot mind előválasztás forduló győzel hozn beszélv telex partiz videó alatt kommentekről támogatja partizános karácsony gergely interjú drasztikus eredmény youtub demográfi osztály használ szólítan mond fiatalság egyszerű hazu közvéleménykutatás gondol,Sparhelt718,-1,1632246283,psmizh,54
6172,hdqmu38,kedves mzp oroszlány szeg tanul hétég otth szavazn előválasztás hétvég otth onlin szavazás teljes betel készült hétvég szavazn jelentkezet felháborító teln onlin szavazás időpont támogatt ahang szórólapozt hely biztosítan szavazás támogatn akar nemes andre ellehetetlenítette szavazás kezd hinn dksok momentumos befoglalta onlin meccselv jakabdobrevkarácsony egyetem ismerősö onlin szavazn tudne kezdj szavaz,szabohanna,-3,1632244091,psmizh,51
6175,hdr0htl,tegy nyer látható kormány menekít vagyon alkotmány bástyázz adósít ország egyszerű terv valószínűleg esetleges vereség élet maradj barát jobb oldal propagand sajtó lehess kormány mutogatn menny alkalmatlan rekor államadósság rosszl egyszerű ember fidesz ikszeln jobb vall egyszerű ember érdekl háttér folyó dolg menny tankol menny kenyér kíván kezeln probléma kormány váltás valószínűleg reményked harm biztos lehetséges,Teregess,0,1632249739,psmizh,56
6186,hdqyfdl,vélemény kaposvár helyzetről pártjelölt szintenaz szavazne horváth ákos beáll jobb zűrös ügyl ráadás botrány kevered sajnos megérzés megtestesít utál somogy kaposvár attitű szülőváros dékás jelöl kaposvár szerezt rand pest katonaorvos momentumos fiatal képviselő tudn sajnos kerül megrendezés mszps pintér attil ismer környe indulhatot dk befolyás rühell helyzet,Valaki997,1,1632248880,psmizh,47
6189,hdqz3go,előválasztás elsődleges jelenleg választás rendszer kettő összemérés egyszerű képes ellenze összefogás legfontosabb feladat választás törvény megalkotás előválasztás szükség kérdés irányul ideális leginkább demokratikus választás rendszer elegendő fordulós rendszer szükség preferenciális szavazás megfékezn egyén választókerület képviselő aránytal előny részesítse választás győztes,yany1,1,1632249155,psmizh,40
6191,hdqzxh4,magyarország polit folytatn figyel hagyja európ állam nyug európ állam orosz gázvezeték stbről lehetn magyarország motor regionális ellenpólus kiépítés mond balt állam egyesítv erőseb keményeb fellép orosz gazdaság térnyerés támogatn kezdeményezés európ pártcsala testvérpárt közös lobbizz európ állam vesbalitkumiszláv bizottság érvényesül régió,garflux,1,1632249502,psmizh,42
6193,hdr0et5,kedves péter érin lehetséges visszatér valamily form iskolap jövőkép szempont fontos kérdés gondol témakör vélemény közoktatás struktúrá jelenleg általánosközépiskol óraszám kerettanterv összetétel megfelelő megfelelő lexikális tudás logi képesség fejlesztés iskola lehetséges javítandó terül felsőoktatás meglátás tükröz nyújtot szolgáltatás minőség szükség financiális színvonalbel fejlesztés kevésb komoly kérdés dolg megváltoztathatn magyar oktatás ráfordítot idejér legjobb kíván elkövetkezendő idősz,galbence22,1,1632249704,psmizh,56
6202,hdr5n9v,kedves péter feleség kérdés tolmácsol keresztény érdekel keresztény világkép nyilvánuln kormányzás alább téma fókuszálv jelenleg egykulcsos kiváltás kerülne kormányzás zseb várható fájn elsődleges szempon szavazat mérlegelés társadal szél sodródott terv hajléktalan társadal visszavezetés intézkedés tervez egyház között viszony ugyanúgy máshogy köszön válasz formázás,KingValidus,1,1632251874,psmizh,43
6247,hdqjv74,mucs kifejezett rossz mondot értelmes dolg személyeskedő műmájer átad nyilatkozat nyilvános dolog szint félrecsúszot mzp eset dolg munkaügyről mondot gazdaság alap megoldan amer hasonló nagyválalat segíten magyarország eset magyar támogatás dolg mehet árnyalat dolg kerület látott legerősebb jelöl szkeptikus kapcsolat elnökjelöltel sajnos bővé erős jelölt befutó anny utál fidesz kikenyszerítet kétpár rendszer ország merő katasztróf,Demisemimo,4,1632242888,pskn2d,55
6328,hdpkq71,otth progr felvehető hitel feltétel érintett igény vegye csokhitel hitel hitel gratulál otthon nevéből adódó lényeg korszerűsíts rohadt családos érint amúgy milliár felvehető csala beszorozz tegy vesz számolv létsza szám gyer mily arányszám tekintv elev eddig intézkedés szegény tényleges rászorúló család célozta milliós ország látsz intézkedés drág,Valaki997,20,1632227324,psftw7,47
6341,hdpcp8v,károgó emlékezt klasszikus éret vicc éves megvett egyszerű trükk leszokt kávézó kávézás főzök eladt autó bicikl kezdt járn megdobot mill egysz különleges leértékel polc igyeksz vásároln —remél siker minden hozzájutn álomotthon tény támogatás ingatlanpiacnakmeg forin magas infláció dráguló nyersanyag utálját felvett támogatás szórja,raMnEmetnemlEl,-14,1632222170,psftw7,43
6353,hdp55u2,elment fasz tanár pofat darab füzet toll ceruz radír ellenorizgett menny sikerül elbaszn oktatás megmond kurv sikerül elbaszn anny elbasztát amenny baszn idiót szop egyet megcsinál nyelvvizsg tanár nyak vesz kurvanagy felelősség nettó forint pofát megmondan szint balfasz menjet anyát picsá troger magatartasot hozz erteset könyörgö,szeredy,91,1632215594,psesbu,46
6415,hdoxau8,mzp karácsony mzp konkrét semm utálatkampány felmutatn ellen alap teljesítmény polgármester karácsony gergely akármek krit élvez irány függetl legesélyesebb hatalmas gyűlöletkampány szem publikus kitörés jakab péter jakab péter elfordít zsidó cigány szavazó ideális ráadás publikus szokot fellépn dobrev akármily ügyestehetségesokos függetl sajnos ezelőtt évtiz kormány gyurcsány utálatkampányháttérszál,foki999,6,1632208104,ps3bz8,47
6444,hdmqoiu,teór fideszes politikus szent győződve hisz ország szándékos csinálja faszság világ értelm probléma próbál megoldan való létez eredmény szint nincsenekképzeljét világot egyszer ember elkezd magyarázn megél asszony almáspit sütöt szerencsesüt nézne ember komplet gyogyós talál baszogass valam fideszes lehet ellenze hang eset esküszö ilyesm háttér,Panesz,6,1632167842,prygn2,45
6472,hdlp84l,igaz gondolkod szavazz ellenze mzptől független dobrev közös miniszterelnökjelöl megy szavazn itten ellenze jelölt szám vállalhatatlan czeglédy kétes ungár péter kezdet tevékenykedn mészáros kapcsolat beszélv jakab fegyőr tűrhető karácsony okés telhetetlen tűni főpolgármester azaz legnagyobb pozíciójú közvetlen választot ember miniszterelnökjelölt ciklus valószínűleg dobrevjakabkarácsony trió nyern meglepetés bárm történh mond kérdés végeredmény délut nyugdíjas látt szavazn kivétel,TheKornel,-3,1632152549,prw7y3,56
6475,hdor050,politi aktivist helyileg sűrűbb hónap állt pult járt utca szórólap kiossz kurv eleg képviselet demokrác elvileg elvileg szavaz jelölt érezz leginkább érte képviseln magyarország megváltozot egyszerű marékny hadházy szerű politikus leszámítv fikarcny érdekeln szavazó rendszer értelm szavazn jelölt lényeg érdekképviselet elfelejthet dolgozz pihenj mindentől függetleníts amitől lehetséges,bjkhu,13,1632203098,prvn5m,47
6478,hdlvhus,konkrét mindennap kurv stresszezl hónap stresszeln plán gimis próbál megérten anny tudsz tenn elmész szavazn befolyás rendszer működés esetleg elmehetsz önkénteskedn noszogathat span menjet szavazn plusz mérés hibahatár belül ráhatás dolg nyugodjál fókuszálj érettség tanulmány menjél csajozzpasizz egyél túrórud jövő április agyalj dolg izgulj választás másnap nyug,SimpForSowell,26,1632155106,prvn5m,47
6485,hdmxkup,azót máskepp dolg négyévent elmegy választan semm tesz ország ellen verhet mell fontos legtöbb ember kivár tisztesség végz munká csala alapí felnevel következő generáció lehetőség épít lokálközösség redvás szendvics gennyes választ öntudatos polgár hagy mindenfél önjelöl vátesz eldöntse helyett akar,KarcsiFater,5,1632170682,prvn5m,40
6502,hdlsydd,mutass bárm bárhol választás szavaz döntöt marh tipp wikipediaszócik lehetn pagedownal végigtekersz képviselő miköz parlament megintcs esély képviselő múln kormányoz magyar számí szavazat szem hópih akarszn akarsz lavin rész venn maradsz lavin akar gondolja szavazn valós hatás végeredmény megintcs mindegy elmész otthonmaradás eredmény,IonSushkaryov,-7,1632154082,prvn5m,43
6539,hdl6uc8,minisztereln jelölt szeretne szavazn onlin bármely sátor megtehet körzet tartozó sátor menn bármely sátor szavazn bármely sátor szavaznin forduló kizárólag sátor szavazn szavazó egyén választókerület választókerület tartoz lekérdezhető több elovalasztashu oldal nézn adot választókerület nyitv sátor elovalasztashu hely szavazóhelyiség megy szavazn választókerület szavazólap miniszterelnökjelölt hely egyén jelölt következtet máshol szavazn természetes minisztereln jelölt,Havas_Henrik_Fanclub,8,1632144494,pru4hy,53
6552,hdkxh6g,bármely jelöl megnyer mond érdeml megosztó jelöl aktív kemény éles választás legjobb jelöl szavazn ellenze jelöl szavazó megérdeml onlin szavazat arány közönség gondoln teljes preferencia biztos dobrev jutn forduló valószínűleg független bíztat minden szavazz menj szavazn megy mozgósító tényleges választás,Zabalint,1,1632139458,prt0iv,40
6571,hdmht5x,szavazt minimalizáln lemorzsolódó ellenzéki szám behisztiz szavazn párt jelölt nyer előválasztás amellet balos bizonyos kérdés szvsz nagy haladna számonkérhető normális közélet képes kormányfő ország pityingervárad doktrín gazdaságpolit képes összehozn emel megjegyezne amiat aggód jobbos kormányozn kizárólag baloldal párt koalíciós partner hisz tudn valamifél kompromisszu születn adóügy kérdés imádat egyszerű anny helyz csávó korr jelöl hideg,szmirk,3,1632164213,prslh7,55
6586,hdliby9,reszemrol dobrev tehetseges tart minisztereln gyurcsany szavazn mult konkretu mondot kerdes vetet jakab egyszeru gyer tart videki szolitan miniszterelnokalapanyag meggyozodv arrol keves szelsoseges nezet vall gyeng sulytal tulsagos oldal mutatt tartog meglepetes fegyor tapasztalatl beer mzp hiteles egyenes sziv szaj kontorfalaz keneget szar nagyresz erten vallasos konzervativ,Atrombit1975,2,1632149658,prslh7,47
6600,hdkuhgq,kösz leírt önkéntes szombat kezdés aktivist logiszt szervez körzet aprócs rész egész menny nehéz önkéntes szabadidő csala pihenés millió eesz készítő milliárd országgyűlés választás szervező nyilv csinál szeretne tenn változás bizony megterhelő megy vide tömegközlekedés pult cipeln polgártárs rendszer milliárd finanszírozot bejárat rendszer hasonlítana előválasztás nehezebb alkal rutin megszervezn hálás nehézség kiáll összefogás eljön szavazn,AlenaSavage,131,1632137535,prrwxa,55
6642,hdkgz1q,szép szavazn legnagyobb esély leváltás összes töketl szavazn abnormális helyz itth normális válasz indifferens mondana slepp vereség másnap börtön zárja kivégzés kizárv magyarország tartja élet szavazne nézőpon jogállam olyan válna lófasz leszar háborús helyzet megoldás háborús válasz jelent ország nemzet rombol következmény gyors arányos időről térn féle látja megtehet,Just-Reception-6162,-9,1632126087,prqf8r,49
6645,hdkkmb6,önellentmondás dilemm létez tolerálható intoleranc vallás esetet tipikus felmer oldal liberális elfogad vallásszabadság oldal vallás korlát működhet gyerek kiszolgáltatot cselekvőképes ember rákényszerít erős antihumanist dolg klasszikus péld burkin dilemm amiről egyéb vélemény engedn burkin ellenkező muszl férj egyszerű enged fürdő nőket burkin lépés közelebb világiasodás elnyomás erősít ruhadarab tart kevésb liberális álláspont burkin elnyomás jelkép látja megoldás véletlen tekinthető dilemm,Zabalint,5,1632129565,prpvne,60
6664,hdhvbta,„tegnap délut ellenze párt ahang informatikus számos átalakítás végezt előválasztás háttérrendszer tömeges terhelés származás hely vizsgálat ellenze párt bevonta frész ferenc cyber services szenior kibervédelm szakértő európ unió tanács dolgozot közölt országos előválasztás bizottság döntöt előválasztás lebonyolítás felelős hatpárt előválasztás forduló szeptember meghosszabbít,mru576,20,1632077520,prdxsx,43
6680,hdiy0rq,menny reális képviselet főleg havidíjas valam tűni gondol rész üresjár könyvelő tart jelleg rész támogatás rész cinkes pénz főnök szerződés cucc figyel megy fizet műsoridő valószínűleg fideszes kereskedelm csatorn terme vonal néző tartal felhívn figyel fontos normális közt kereskedelm alap részrehajlás működ,_adam_p,8,1632093712,pr9mf1,42
