,comment_id,text,author,upvotes,timestamp,post_id,lens
20,hgihabm,erzséb amál eugén ausztr császárné magyarország apostol királyné csehország lombard velenc dalmác horvátország szlavón galíc lodomér illír jeruzsál királyné ausztr főhercegné toszkán krakkó nagyhercegné bajorország hercegnő lotaring salzburg stájerország karint bukovin hercegné felső alsósziléz hercegné erdély nagyfejedelemné morvaország őrgrófné habsburg tirol hercegesítet grófné,RandyCheck,1,1634149035,q7gkbm,43
25,hgifqam,érdekes minden megzsarol szem gyùùùùùùcsàny felmutatn bizonyíte molnár felidéz adot karácsony délut klubrádió beszélgetn gergő állított részéről kiszállne konfliktus gergő szerelm kezdt konfliktus lépj léptél gergő márkizay kérés tompítana tompítan hajítottál gergő komoly molnár egyszerűbb kínos magyarázkodás elmondan szimpl igaz nincs zsaroló smsek,qrvasokk,-24,1634148399,q7g5ae,43
79,hgi5d66,említet záveczkutatás természetes mond dobrev klár legnagyobb esly legyőzn viktor kérdés szól ellenze miniszterelnökjelöl tudna leginkább legyőzn viktor kérdés alkalmas megtud jelöl tudna legjob legyőzn nyilv gondol csapat ehelyet mond kérdezn hajlandó támogatn hajlandó támogatn amúgy kutatás látsz mzp legalkalmasabb szavazó nézz aktív boizonytalan titkolózó kariger mzp megy forrás,csarmi,21,1634144357,q7ewwe,49
161,hghqoxi,megnézt majomparád párszor megfogadt tesz sajnos munkahely kolléga szentírás vesz szav úgyhogy tudj cáfoln kérne segítség megütött sirkó zolt kertészet főtanácsadó millió forin rész talált fickó semm hódmezővásárhely oldal tudn mondan valam igaz segítség böngéssz város honlap tudna vetn tényszerűleg kamu,Mr_Zey,6,1634138394,q7cppk,41
204,hggzoac,benyomás kelt sztor szemléltess gyerekkor dédszül udvar fészer valam messz kerüln amúgy járkál macs kuty nyár vakáció töltöt hétvég esté győzöt gyerm kíváncsiság odalopózt ajtó kinyitott felkapcsolt villany visszagondolv csod működöt megtermet patkány hangos sivítv kezdet körbekör szaladgáln ferike patkány hosszú nyugal felkapcsolta villany,CronosHUN,118,1634125295,q7938q,44
228,hgh6cj0,fiatal jelen hüly többség fideszes dk legnagyobb nyuggerkommandó fidesz rendelkez legnagyobb fiatal szavazó leszámítv fidelitasos nyom többség papír elmeroggyan szavazh fiatal hagyományos párt főleg dknak tartan fideszes hagyományos párt képviselő ellenz megijedt dinoszaurusz drág klár klárin küldv ahov büdös franc,CaligvlaPannonius,7,1634129258,q78jpy,40
252,hggs2sm,isten oltvast kritizál átfogalmazot hazaárulózás látszot tiszt dk kapcsol legyártott márkizay mondat aktuális köteles besze dobrev mondat sejtet dobrev szavazó hazaárulózot ellenfel egyértelmű üzen igaz „hazaáruló hagyt márkizay összehozt jakabos interjú jobbikos áruló jakab dobrev ugyanígy kifacsart szav jakab áruló riporter hangzot,arnoid,5,1634119674,q77or4,42
279,hggiu2y,mármin miniszterelnökjelölt minisztereln választ közvetlen magyarország anny összefüggés list szavaz miniszterelnökjelöl hagyományos list értel induln akar dk ésvagy list állíts mozgal elev bajos menn anny bejáratot jelölt dk tehetn körzet boruln egyezség jelölt ráinduln ellenze megszívna legnagyobb fidesz nyern rakás körzet nyern egyén harmincvalahány százalék,marcabru,30,1634111168,q765lh,45
285,hgglqm1,dknak teljes induln list képviselőjelöl összesség kevesebb hely nyern ellenze beleértv többszereplős ellenze verseny valószínűleg ellenze választó büntetne jelölt mostan biztos befutó jelölt hely bizonytalan váln megmar összefogás indí ellen egyegy közös jelölt fidesz mostan támogató elpártoln mszp sors jutn,gd42,2,1634113893,q765lh,40
287,hggpsya,szcenárió mzp kilép összefogás teljes próbál induln összefogás felevickéln anny kiír mindenhonn kiút megvol reggel elmúl szokásos aktuális mzp összeomlás dk antal egyesített rendszerváltás párhuz mohács csat gyurcsány ferenc vétózt legy hatpárt egyeztetés szokásos bizonyítatl bizonyíthatatl összeesküvéselméletesebb handabandázás rész kapás cáfolta gyurcsány péter hazudj,wombatstuffs,1,1634117688,q765lh,44
299,hgilibx,sport köthető ember réges focist tempósabb gond idősebb közel maradv csurr csepp kapot szakm tanácsadó pozíció semm kinéz edzés rendezvény odaáll zsebpénz szolgálat autó benzinkárty nyilv bicskanyitogató egyszer jutot pénz szem szúrh megoldás születet lecsökkentette dezső különböz menj feleség papír felvette takarító igaz tényleges végez elbír,Pangelus,1,1634150740,q7652e,46
318,hggyqvq,beparkolt mamá nyilv felmerül előszavazás természetes kérdezt szavazt mzpt mondt egyből kont hüly külföld bérenc fideszes kilépet monológ fojtott csírá dolg mondv politizáln jött gondolt enny bolonduln pártbaember reakcióidő ömlöt ócsárolás mond anny vágt hódmezővásárhely polgármest tudt szeret teljesítet legszimpatikusabb jelöl mond egyből kont mondat nyugtatt beszélj klár nyuggerkampány,Shaman_Shanyi_222,3,1634124676,q75q03,49
323,hgh1ymu,kommen való primitív venn mzpszimpatizáns dobrev dksok támadja dksok mzpt tábor kizárólag fidesz kedvez uralkodj elmúl folyamatos szálln vonat dolg ismételgetn győzni fidesz mzpre szavazn dobrev tetsz győzel ultraaktív gyökkettő agyú kormányzás dk frakció elfogadn vesz rész egyáltal előválaztás anny csalódot pontos ugyanit tart,uspecific,1,1634126745,q75q03,44
350,hggbqef,dobrev mellett dk sajtóosztály félór elküldöt kiállás forrás megerősítet információ márkizay péter elmúl megy főváros olyanny magabiztos dksok szoros verseny dobrev támogató szocialist informátor márkizay győzelm számí előválasztás stand hangulat közvetlen követő forrás érzékelhető egyfajt ellenzékváltó attitű elmúl évtiz fideszes figura eleg elmúl baloldal politikus,FZolee,270,1634105249,q745oc,45
373,hgg7six,egyértelmű fasizmus zsidó kiallitas felreérthető integetn zsidó kiallítas hitlerbajusz mutatás hasonlít friendly pusz dobn hitler cosplayer fotózkodn érdemes nézn videó múltkor partiz interjú szeged tóth péter meleg geneti hullad nevezn rossz szóhasznál élettér fajvedő egyesül oszlopos megválasztot kivessz rossz rész pedofiltörvényből,catsdorimjobs,19,1634102412,q6yf74,41
404,hge93i7,elszámoltatn korr megvalósítható ötlet hallott lehetn kivitelezn korrupció legnagyobb rész elev formailag legális elenged tört nyom rendszerváltás agyonlövetés máshogy szétfésűln főleg rendszer igazságszolgáltatás komoly rész fidesz tett hely ugyanúgy parlament erős szám nyer ellenze hajszál tesz brutál nehéz amely lépés haladn elszámoltatás reális egymás követő kormány igényeln stabil politi helyzet szükség elkötelezet vezető esély következő,jackingOFFto,65,1634069062,q6typm,55
421,hgecuqo,hónap ezelőt gondolt minisztereln fidesz akar számoltatn megérdeml gyurcsány teljes biztos vall igencs vonzó ember atvs interjú hozzátesz ellenséges kijelentés bírálható főként kiforgatja szav dk suny band zsarol mszptől folyamatos csábítgatja ember tette ezelőt suny ugyanaz fidesz marad ellenze oldal minden bedarál sikerül kíváncs holnap szám részvétel kapcs mutath valam százezres szám kellemes biztos,kakykaky,12,1634070607,q6tngh,54
468,hgdgz7l,szenvedés összeall koalíció potenciális esély legyozn fidesz szavazol automatikus fidesz malm hajt akar plusz valószínűleg dobrev teljhatalm hatpárt koalíció szavazol minisztereln személy kilét tulajdon lényegtel kénytel demokratikus koalicioken működn márp kénytel dknak kisebb tényleges hatalm fideszkdnp ország politikailag fiatal érts koalici működés,brown_epres,36,1634057565,q6qaxx,42
479,hge1tv2,igaz több hibáz péter betud kemény vissz program megy mérgezet egér hajnal szónokol vide piac szétfeszít meggondolatl kiszólás előfordul pihen pörög rossz teljesítmény rutinos dobrev tudatosság kiszólás visszább venn pozitivab üzenet külden fűggetlen remél szembesítv dobrev fidesz szíd magyar kiválasztott gyengébb ellenfel küzden,Signal_Hamster6245,8,1634066135,q6qabc,43
494,hgdwhbk,minden amenny való dobrev nyer fogad fidesz győzel egyszerű anny dk következő rengeteg hitel rengeteg ígér biztosítot súly sajnos várható fidesz mzp bőven jöhetn dobrev kormány mzp eltűntess jobb baloldal terület politi korrupció csök ember nevel gyűlöl következő bőven fedezet aktuális kormány tovább menj youtu gyurcsányozás dobrev probléma időzítés,Dave_262,15,1634063953,q6p81g,49
496,hgdlz7x,mzp miniszterelnökjelöl elmenn szavazn belefáradt jobb szavaz hüly országgyűlés választás forduló szavazhatt töltött mszps fickó fideszesből választe rühellt fidesz mszps jelölt szavazt legendás korrup balfasz összes választás jobb balfe szavazt legutóbb takti szavazósd ultragáz jobbikos szavazt hozt eleg jelöl elkötelezettség szavazhat megy hosszú mzp kibillentet érzésből szavazt,szukebbpatriarka,56,1634059657,q6p81g,47
512,hgdoa7t,rásajnál szavaz olyan gyurcsány jobboldal beállítottságú ember tőlemzp szavazne állnad gyurcsánye sohaez pontos tudja központ isez támogatja dobrevetmzp számított többi véveesélytel dobrev nyern rosszindulat mondomn gazdaság szereplő egyértelműhogy dobrev nyer tovább baloldal felvenn kapcsolatoth mzp toln büdzsétaz hitt bonyolultabb kérdés egyértelmű,liquidvic,2,1634060585,q6p81g,41
535,hgdmibp,egyetért mindez mond tiszteletlenség hangz egyszerű igazság idős ember bámulv egyszerű jobb dolg elmenj szavazn történ adot csatorná kapt agyzsibbasztás magyar szavazn tájékozottabb ember látja dönt segít kijuttatn ország szar évtized orbángyurcsány tengely tapicskol ugrál akadályoz szeretne látn vezetés akitől hányinger memeln korrup haver jövő pislog hajra mzp,Icandodgebulletsbaby,3,1634059874,q6nyvi,48
537,hgdgh8s,jelöl szimpatikus akart mondan jelöl pénz nyom zseb komoly nyugdíj emelés megvett nyugger minimálbér emelés szja mentesség megvett taknyos nyug nyugger sértő érdekes amenny fityisz hall bárm tenne ellenze oldal hallott egyből ráharapne gyúrcsány show ssshh érts sárga álln szeretne szóbel ígéret komikus vicces legutóbb kétfarkú tömeg mozdíts,KiLLTriK,2,1634057359,q6nyvi,48
544,hgcrjbp,család kapcsolat dolog igaz határolódot áttranszformál vagyonelem felhasznált emberarcú szocd fontosabb minisztereln kabinetfőn később közel családtag apus puccsol mélt sikeres minisztereln poszt váltot ugyanoly szektapárt visz narancsos band személy kultusz változot miut apus anny gyűlöl esély hatal megszerzés szerencs bátr vállalkoz ugyanúgy altus visz vinne ország tulaj ügyvezető,Hokunda,8,1634046832,q6mfww,48
551,hgcrp0l,kérdés alapvető legtöb korrupció szeretne minimalizáln emellet versenyképes magyar közigazgatás gazdaság látn elmúl politi elit képes megadn dobrev sajnos elit tartoz mzp ígéret ügyn akta nyilvánosság hozás balls wall korrupció harc featuring hadházy szakértő kormány kontraszellektál lojalista esély bepótoln rendszerváltás,Temporary-Donkey-714,13,1634046906,q6mfww,40
569,hgcfvh9,kommentelő nyávogás mzp nyer előválaszás déka december otthagy összefogás alap szósz post olvast amúgy beszél ellenze szövetség szétbomlás dk értelmezz mzp nyer dk felrúg megegyezés fasz gondol hangzatos leírn veszély összefogás kérdez anny emiat belépj facebo párszor megfogadt interakció kommentszekció elmegy életkedv válasz,PJohn3,19,1634040645,q6kn1b,43
575,hgcnxp6,dobrev márkizay december tudna tartan ellenze összefogás ismer polit tesztoszter hiúság egyresz sikerul klar eljutn hillary vagin kozot szavazn szintu retorika masresz megern mzp nyilatkozot klar osztrogenszintjerol klar aprilis errol sirt facebo bancs szegeny pontos noken fikazhat ferf ferf ferf fikazhat jellegu okadmany fasz ember vezet legyet korrekt basz varhatt egyenl banasm enny lement legal szint,thenoobient,19,1634045096,q6kn1b,56
598,hgchr2g,english speaking accountan depending your circumstances migh egyén egyszemélyes accountan tell which your needs with minimal paperwor accountants only charg abou month limits much bill yearly cann recl vatáf which migh drawbac business expenses although doesn soun will doing remot,PJohn3,3,1634041776,q6ji9b,40
607,hgce90z,nézt pottyondy edin videó több mzpt kritizál teljes jogos klár autob szag dolog kommentel mzppersz sejthető edin szavaz valószínűleg mzp nyíl kiállás mond puzsér juhász péter influenszer edin csakcs hisz videó híres keves momentu juhász péter híresebb megjegyz takti összefogás szüntetet gyakorlatilag,Valaki997,5,1634039624,q6j8hj,42
609,hgc6g9k,"azer nepszeru dobrev szorgalmas letrehozt halozatot dobrev onkentes vegiglatogatt szavaz lathat szemelyes megjelenes meggyozn elhanyagolt tobbi teljes jelöl megnyern jövő választás hely szint mobilizáln képes házaln telefonálgatn méltatlan jelentőségéről végsősor kubatove felismerte fidesz választókerület szint tudot ember kampány mozgatn választás végighívta összes potenciális szavazó gondol adta alább",koszos09,21,1634034071,q6ipa2,47
611,hgcep5d,semmifél szektamentalitás pártérdek tűlérzékenység egyszerű mzpt ember választan kormány akar váltan rendszer nyugat stílusú demokrác szeretn durv baloldal mond létrejöhess normális jelentős baloldal érdemes szavazn alapozn magyar demokrác mzp alkalmasabb korrup baloldal mondó hatal harcoló neoliberális jelölt szociáldemokrat mondana személyes vélemény,Kingkiller1011,5,1634039909,q6ipa2,41
626,hgcbi9x,gyurcsány egyar leváltan akaró ígérte magyar nemz egymag dobrevatikus kláraíció pártlap alakul tudn hazudn választás kampány jobb haza egyar libsiző szavazó valahogy lemar cikkből rész szól balodal közszereplő balodal jelölt szeretne minisztereln többpárt koalíció ellenze szegmenséről márkizayatollah eset legkisebb prcsor egyből ádáz tagadás terelés párhuzamosvilágteremtés idézet mérvadó újság tematiká,KingOfTheCh1ll,0,1634037828,q6ip09,49
651,hgbzktj,mond szerd előválasztás egyértelmű győzne rajongótáb enny ráér mozgósuln szakí előttut legkésőbb szombat bikás perc megvolt aggasztó idős hölgy idősebb körülött értéknyilatkozat aláírató mesélt idős kérdezt lehet viktor szavazn válaszolt hatás kedv valahogy megtehet halogass legutolsó pillanat foss rendszer valamily fogv megszívt,ItchyPlant,41,1634027782,q6hild,42
673,hgc1a1f,képzeln emberekről követ aktív polit akar állás foglaln szavazn főleg szimpát választ való biztos csalódot fideszes főleg koronavírus előtér kerül polit szájer kalet hang kapt kisebb alternatív hasonló konzervatív nézet vall eset mutat ellenze szavazó szólítan centralist baloldal jobboldal hiteles tűni polit induln,gyurcsany_viktor,7,1634029374,q6hb09,43
705,hgbvuvn,topreng evny orszaglas fidesz mier nagyszeru eredmeny kampanyol nyugat politikus eletrajz dicsosegrol mesel mier kovet viktor mutass rengeteg jotetemeny kival mukod rendszer javitott mukodes felviragzot gazdasag gombam szapor kisvallalat felporg magyar kutat eredmeny hasznalj csucstechnologias term felmeres eler ustokosszeru javulas gondol vegezt nyern valasztas pillan kisstilu baszakodas,Durumbuzafeju,291,1634024322,q6gn99,47
728,hgc5gyf,dizelbotrany megmutatt szabvany valasz felelos miniszterelnokken gondoln lehetn hybri vasarlasnal fttal beszamolj rosszabb hasznal diesel dizel vasarlas igazabol megold piac megvenn hybri hajtas kategor lehetn tamogatn ftvel elektromos tesz auto hybri csereln tamogatas kapn grat kerdez markyzay higgatab felkeszulteb legkozelebb reagaln,laplasz,3,1634033222,q6geia,41
729,hgbst1i,rendel alkott tagállam elfogadás nehezített hosszú magyar lengyel kormány blokkolt hétéves költségvetés milliár eurós helyreállítás alap budapes varsó visszalépet vétó indítot jogállamiság mechanizmus megsemmisítés gyorsítot eljárás keret zajl rendkívül bíró tanács amely tagállam bíró komoly rossz vicc itthon kormány itthon adóforint szétlop nemzetköz szint lejáratja ország akadályozza haladás egyszer eltűn süllyesztő normális emberközpontú gazdaságilag értelmes döntés hozó kormány hely,Tao_Dragon,19,1634021688,q6g82q,59
735,hgcby20,dk mszp rendszerbel szar leszármazott gyűjtőhely tökéletes megfelel mostan posvány zavaros halászás null milliós fizu tankolókárty legújabb iphon ügyes dörgölőz lees zsírosabb közbesz állampárt csod foggalkörö küzd mostan helyz fenntartás kevésb gátlástalanabb fideszes tőről félreértés esse dobrev nyer előválasztás szavazn igaz rendszerváltás elszámoltatás hasonló parazita végleg tűnnek polit,cptmpeterson,5,1634038117,q6g4kf,48
739,hgbzd5o,mzp fidesz konzervatív hívő ellen népszerűség jelöl hataloméheseb tesz elmúl művel hasonlítan despot cselekedet főleg legyőzn szavaz fideszel mzp folytat könny szétver összefogás felejts összefogás elmúl abszolú érdem elvár összes választó éljenezz messiás pontos eszembeju politikus történelemből szint túlnőt népszerűség poltikus kifogás keresn anny forduló szavazt,Sky_HUN,-2,1634027583,q6g4kf,46
743,hgbpuwz,dk törzsszavazó nyilv érzelm kérdés zseb szavazn fideszes troll karöltv dobrev klár fidesz hasznos idióta akadályozza dobrev politi hatal jutás polit érzelm kérdés lehetőség tudomány józan mérlegel tehet márkizay péterr szavaz kétségbeesés pocse érzelm közös demokrata fogja látn dobrev győzöt,potafbam,56,1634019336,q6flmc,40
746,hgbyg49,márkizay győz legnagyobb frakció egyrész dk baloldali erten dk gazdasagilag mzp szocikpmlmp tenyleg vallalhat jelol leszavazt mzpre probal eladn ideologi ellenszel esetleges koalicios kormany partszovetseg szint gond mzp antiestablishmen aspektus egyaltal gazdasagiideologi igazabol ugyes influenszer csav trump amugy mzpt fidesz rendszer bomb nezn szethull baloldal epiten,halfbloodGS,9,1634026715,q6flmc,46
750,hgalbqe,vesz rajongás mzpnek szól dolog rendszerváltás eltel establishment kívülről kurv nagy megy ember mzpnek hívja tökmindegy erhu érdekes tört rész amellet mzpre gondol komoly mértékű buzulás mémel egész kommen posz szem poszt szül rákontráz mzp kezdőd elölről öngerjesztő foly nyilv politikus iránt rajongás kulturális beágyazódás magyarország történelm mzpnél koránts enny vészes helyzet,CronosHUN,57,1633998136,q694ov,52
756,hgbbwqr,mzpre rárakja atyus szerep ország oldal függetl mindíg kádár kihasznál viktor véletl pozíciónál kádár irány megteremt betevőt megvédel mindentől feladat szolgálj mzp populist igér igér világmegváltó orbánkarácsonydobrev vonal megigér iksz mzpt támogat hardcoref túltolja rajongás igérg plusz gergő főváros városvezetés,AngelusLocius,9,1634010397,q694ov,40
758,hgbwtgw,magyar amúgy hajlam erőskezű magabiztosság sugárzó vezető gerj meglepő ront helyzet intenzív népbutítás foly csúny populizmus szegényebb butább réteg végső mentsv populizmus győzhet populizmus óriás különbség olyan álmodozn baloldal értelmiség vezet ország elmúlt jobboldal populist polit kormánytváltan technokrat egyenes kiröhög ország,Minizs2,2,1634025190,q694ov,41
760,hgd49yt,veszélyes támogatn mzpt mondan kisebb rossz rászavazn jelenten krit sikerül lépés kijelentés magyarázn néhány tökély fejlesztett mzp hülyeség szám kérn mutogatn bezzeg rosszabb mondot gondol visszalépés körül abszolú következetes kijelentés hazaárulózás bizonyíték nélkül gyanúsítgatás egyes mentális gimnaszt védte cselekedet őszint ijesztő rosszabb bárm haladás elszámoltathatóság akarna elérn ország lépn ‘kedves vezető’ mentalitás támogatn anél hibá ignorál,onewiththecake,2,1634052381,q694ov,56
768,hgan955,látn fidesz propagandá fideszes ellenze esetleg ellenze szereplő ugyanaz akarja módszer biztos szeretn menn párt helyez előtér konzervatívabb polit nyom dolg szeretn behozn polit megbízhatóbb bizony politi hátt tekintet anny ellenség nézet vall helytálló összeesküvés elmél lejárató szöveg olyan helytálló bálvány támad kormány igaz feltétlen fidesz propagand hibás véletlen politizál hüly meggyőzhetetl fejlődn képtel logikátl ember,gyurcsany_viktor,53,1633999053,q68bsz,56
811,hg9j8fi,offtopic szavazó pest méterről kamerázz szavazás álló hátulróloldal közelebb jött pont beállt szavazó premier plán vett minden szóln szól rohadék sorbanálló forduln kamer beszéln rohadt kedv gondol prostisrác címlap virítan balhéz hisztis libernya gyurcsányist hazaáruló szalagcí maszkjakapucnijastb szervező kapot küldt halál levideózták… kapt szervezőkszavazóbiztos eligazítás csináln,DFFanni,101,1633980294,q62bgp,46
839,hgbrsik,mond lenn viszonyítás pont elmegy mzpre szavazn befog rengetegszer újraolvast mondot gyerekverésről próbált valahogy felmentés értett érten sikerül akarhogy elfogadhatatl mondot esetleg egyegy pofon adot gyer százezer gyerekverő szülő megmagyarázza művel belefér rajongás feszegetn mzp szempont legjobb ellenze jelöl mosdatn relativizáln valam hibá,Zabalint,2,1634020877,q60xen,43
878,hg8puyp,hódmezővásárhely polgármester ember lépés „nemcs karácsony gergely árulja haza vesz panasz folyamatos nyomás helyezv kényszerít mindenfél módszer dobrev miköz pontos tudja viktor tartja hatal fogalmazot miniszterelnökjelöl elmondás panaszkodt akar mondan „sajnos több belekényszerít belezsarol egyegy nyilatkozat kellemetl családtag megvet hozzátév politikus zsaroln próbált,szeredy,3,1633968064,q5yryi,43
888,hg8xl0l,fodor gábor anekdot felelevenített eset szab választot parlamen alakuló ülés haraszt miklós elkezdt igazgatn viktor csál nyakkendő viktor használt nyakkendő kért kölcs vágvölgy andrás sértő nyilvános nyakkendőigazgatás teljes alaptal apró sértés viktor haraszt miklós szdsz egykor ügyvivő szerett fiatal liberális politikus korsz letéteményes látt gesztus szeret megváltozot önmag túlmutató eseményről kemény istv költő nyakkendő vers kurv sztor haraszt,QuanonShaman,5,1633971257,q5y1l9,58
895,hg8id9x,márkizay márkizay péter híradó kérdés miszerin szól politikus közszereplő karácsony gergely támogatta forduló nyilvános dobrev állt „alapvető szomorú nyilvánvaló helyzet hatal tartás szolgál kiállás „nem karácsony gergely árulja haza vesz panasz folyamatos nyomás helyezv kényszerít mindenfél módszer dobrev miköz pontos tudja viktor tartja hatal fogalmazot miniszterelnökjelöl,dtfg5465,19,1633964897,q5xrnx,46
936,hg8c83y,újkor feudalizmus épített függj fideszes polgármestertől közmunkás nemzethy oligarcha szolgáltatn szeretn emellet leépítette fontos közszolgáltatás egészségügy oktatás terel minden fizetős magánszolgáltatás miköz rész pénz nerből támogatás magyar gazdaság versenyképesség növelés kitömés fordította vállalat megvett pénzünkből versenyképtel csakis mesterséges generál igény kiszolgáln piac megéln nersportcsapat legnagyobb pénz megvetette ország,persicsb,42,1633962201,q5wvwe,48
939,hg8d9ff,aljas pofátl képmutatás pedofíl közpénz ellopás undorító lejárató kampány marade magyar kultú eltaposás lealacsonyítás magyar ember megalázás szembeköpés kamuzás jogállamiság lerombolás hatalmas infláció hatalmas ingatlanár ember megsértés hisz pont tudne menn felsorolj összes szennyes szem dolg undorító gengszter rezs elkövetet szavaz kérdezne,NotSchofield,8,1633962667,q5wvwe,42
1085,hg7o2j9,szakmunkásképzés felnőttképzés dolgozó közgazdász kiég elmegy pékből bankár nehéz kimozduln szakm éves válasz ember szül fóleg pénz visszamenj családos gyrekes ember esélytel váltás ismerősö élet polcfeltöltésretakarítás kényszerített szül szakmunkás elzavarta dolgozn ahelyett ráhúzot érettség kormány egyértelmű belőtt irány összeszerelőország millió biorob félő prof győz egyegy szakm elju szint automatizáció olcsóbb biorobot félelmetes gyors tömeg munkanélkül váln specifikus skill rendelkez,jakeshervin,5,1633947364,q5qz6v,59
1178,hg5trvf,mzp szimpatikus szavazn enny folyamatos hangoztatv minden megszólí unalmas konkrétu való megszólítan minden előválasztás megnyern hozv húzóbb tartózkodó szerezn feltételezv baloldalabb húzódó változatlan támogatja menn ember szavazn anny foglalkozt polit irányultság passzoló jelöl sincs irány konrétu nincs konrétum beletartoz rendes progr rendelkezz jelöl szerencsésebb létrehozn kampányoln reális erőteljes hangoztatn mzp beigér nagyesély teljesülígéretfigyelő,I3ollasH,13,1633906387,q5gxgq,53
1187,hg5eqtb,kisebb kapacitás üzemelő személyes szavazás ráadás érdeklődés kapás zakatoló onlin voksolás tipp között szavaz mehetet onlin következő fogy lefoglalható időpont mondat mzp forduló egyéb személyes leadot szavazat kapt dk mzp onlin voks eset dk mzp aktivist hallan tapasztal személyes voks megoszlás tudna becsüln személyes onlin részvétel érdekes remél publikálja,kiszol,13,1633899773,q5gc86,49
