,comment_id,text,author,upvotes,timestamp,post_id,lens
4687,hekg434,haver táje sírvaröhögv mesélt fidesz tagság történet fiatal idealist egyetemist belépt szülőváros tagszervezet építse jövő bírta hónap dúló tömény sötétség tldr székház fiatal emléksz harmincpár elbaszot arrogáns csicskáztat miniszter oktat ország ciklus kormányzás minőség zavart kért méltóságos mondj akkor választó gerinc,fricy81,13,1632811688,pwtrs3,41
4711,heikh2c,megszavazt parlamen alapítvány kezelés adot egyetem finanszírozás szóló törvény kormány közel kuratórium irányítot alapítvány következő milliár forint költségvetésből felsőoktatás finanszírozás félszeres ellenze felvetés válaszolt kormány forrás biztosítás egyetem alapítvány közbeiktatn nyilv több lopn esetleg elbukja választás irányítan rész oktatás intézmény,Tao_Dragon,1,1632776248,pwqej3,40
4713,heimjag,kérdezt könyvelő egyáltal létez akar péld gyerekes csala szülő egyszerűség kedv bruttó bruttó kereső vett igény család adókedvezmény fizetet szjat semm szülő visszakap forint szülő felefel arány vette igény család adókedvezmény forin felett rész adózt adómentes felmegy visszakapja forin azaz csala összes visszakap forint vicces,Halal0szto,23,1632777187,pwq1zo,45
4765,hehnpx6,egyszerűbb karácsony mzp másodikakharmadik lépn kezdetektől fogv szavazatkoordináció párti nyilv tudja dobrev megosztó jelöl jakab beju dobrev körös elsőség változ kérdőjeles márkizay jakab megosztó jelöl márkizay felmerüln esetleg mzp maradn kieset jelöl választó támogatás bízv felven kesztyű dobrev egyéb biztos dobrev nyer forduló karácsony valószínű kérdéses,Zabalint,30,1632761349,pwkp7d,46
4771,hei31jj,őszint szólv szcenárió rossz ellenzéki nehogy nyerj karácsony ember elvinn szavazn sajnál klár jelöl megkövezés kapn leír örülne szükség forduló kinyilvánítás anny nyern százale fölöt klár elev esélytel karácsony beelőzz esetleg mzp jutn forduló visszalép hatás mond százale előzn karácsony nehéz elmagyarázn dkszavazó mondhatn legelkötelezettebb ellenze magszavazó mièr koordinál többi ellen fidesz tette bizarr,markg128,4,1632768369,pwkp7d,54
4845,hehrfwf,értelmesebb rendszerszint tekinten kormányzás leragadn pozitív negatív döntés kormány hozot nyilv olcsób ingatlan autó pénz szeret egyet kelet tipusú illiberális demokrác itth szingapur annyiszor követendő péld felhozv megy hatal azót elvileg demokrác évent szavazás nyern oldal pics nyugat liberális demokrác mzp skandináv szocd modell kariger működne,TinyCuteGorilla,5,1632763136,pwf36u,46
4846,heh3xpq,menekül kérdéses bécs péld nagyolv bécs semmifél ilyenről hallott tanár diák csador viseln bécs multikult város természetes tartoz muszlim legtöbb sokad generációs százale integrálódot európ társadal tavaly belváros lövöldözés kivév rossz élmény migráns rendszeres járt nagyrész török szíriai exjugoszláv lakot kerület egyéb hírh lázár bécs propagand videó készül other sajnos hajléktal csutakrészeg magyar hazafi kevésb kellemes élményem…,ScoutyHUN,13,1632752794,pwf36u,57
4852,hegykfq,naív hüly tudhatna szól egyáltal fidesz hatal mindez kétharm kommunikáció kimer gyurcsány választás ígéret elszámoltatja gyurcsány fenn jelzet tört megkérdez ember megállítsa gyurcsány elev mondt fogja állítan mindezidő gyurcsány parlament képviselő elmon valam gyurcsány kihagyt valam gyurcsány rockkoncert megvette jegy várja koncert megy show levon zenekar kórus zenekar visszaj színp énekes megkérdez tömeg akarját játssz,burneraccs,55,1632750347,pwdx1i,55
4909,hefxj1c,függetl gerjesztés mzp behozot mérsékel racionális kultúr hiányzot magyar polit legtöbb bizonytalan függetl oldal hajl sajnosn sajnos nézőpon kérdés konzervatív beállítottságú ország igényl erős szociális polit vélemény mzp kitöltöt hatalmas váku látsz jakab lenyomt nyílv intern közösség rhungary felerőssít imádat koncentrátum,Chris_Hugo,62,1632722234,pwakzu,41
4960,hee6eq8,mzp akármely politikus dobálóz konkrét tudhat szavazás állás félhivatalos hazud szavazás hitelesség kétség választás csalás illetéktelen tudomás jutot információ próbál befolyásoln szavazó dk kiparancsol nyugdíjaskommandó bocs röhejes ember érdekel dolog anny felállt seggükről elment szavazn mindeköz szavazn szar elmenniregisztráln onlin gyurcsány,utsuriga,-8,1632689745,pvzrbf,41
4961,heeeau9,mzp döntöt folytatn gyűlölködés list fideszes módszer járatv szánalmas ugyanot fidesz buziz cigány listáz gyurcsànyoz kreativitás fasz tudot mzp lerobbann agyilag fidesz megbízot többi összekap korrupció összekap dobrev megoldás megy mzp fröcsög levegő semm fasz megáll szóln gyurcsány csapkod csal vazzeg csalánt,qrvasokk,-20,1632693172,pvzrbf,42
4984,hed8u9d,kérdés ismer személyes miniszeterlnökjelölt szerepel autentikus nyilvánosság játsz szerep változtatt világnézet elmúl polit töltöttél említ normaf nemzetgazdaságilag kiemel terül fontos szám gondolsz dobrev dk feles többségű alkotmánymódosítás tervéről gondolsz gyerekvállalás szeret gyer vállaln jövő száz lehet etikus tenn utóbb főleg klímaváláság gondol kedvenc politi kösz válasz,zaga9,18,1632676326,pvx23n,46
5008,hed3gcc,tudna vázoln változn ország momentu kerüln vezető ülés főleg érdekel instabil erős inflálódó forin helyzet javítás abortusz kérdés lgbtq közösség elfogadás bérezés probléma feloldás szektor legrosszabb teljesít európ dolgozó tanár mostan kormány kormány közel ember felelőség vonás általános jólét érintő változás személyes érdekel dolog,_Ulfhednar_,12,1632674051,pvx23n,44
5020,hedi2xq,momentu erős centristaliberális identitás programot legjob szocdemektől vesz inspiráció oktatás housing firs policy üreslakásadó dolg erős progresszívbalos vonal programot vállalját balos identitás vett berg jobboldal képez legalábbis gyanít vállalkozó szöveg kiindulv gondolsz pártot program elöbb dolg progresszív üreslakásadó befolyás vinne irányvonal szavaz választás személyes fontos,lajosmacska,1,1632679903,pvx23n,45
5031,hecricu,budapest vágány vasút kitérő vasút hídrendszer milliár ennyiből bécs főpályaudvar fejlesztett millió euró milliár forint költött vasútállomás kapcsolódó vasút infrastruktúr hektár építkezt kilométer vasút fektett kilométer zajvédő épített vágány személyvonat közlekedn autószállító vonat létesül megépül üzletes bevásárlóközpon autós mélygarázs állásos buszpályaudvar,ZawiNull,59,1632668985,pvuy7m,41
5055,hedog8v,szegény viseln smsek eköz aktivist óráz operátor szombat anyuka szülinap bejuss felület vide pultozn szórólapozn szabadnap sátor rögzít adat telefonál aktivista menj szavazó sátor eleg előválasztás szeretne rendszer váltan jobb dolg csinál csinál tenn szar olvasn legnagyobb gond smst karigeritől,AlenaSavage,0,1632682455,pvu3xz,40
5057,heduwrk,önkénteskedt előválasztás tapasztalat posz szavaz próbálja titkoln megkapja szavazólap adatrögzítő önkéntes beikszel akar tapasztalat szavazó máshogy asztal felül nyomn mielőt behúz iksz önkéntes akaratlan szavaz tudsz csináln emlékezetből összegzés láttál dobrev húzot kampányközpont helyről infó megy készpénz fogja venn jelölt mindenhol tapasztalja,szofter,13,1632685062,pvsrm5,42
5062,hec66dv,dk csinál herót ember sztor amúgy ágnesről részlet kifejtés ezelőt rész vehett évesekből álló csopor napos parlament látogatás megnézhett megy kisebb bizottság ülés menv találkozt ágnes amellet nézet minimu alagsor feltörő patkány lenne jegyezt párttárs jövő fidesznyi elhaladt pártalap megszervezv látogatás,Tnil_1,22,1632658408,pvsl6x,41
5066,hec2kze,talált ragadozás commen talál lehetn direc copyzn mond egyszerűbb megoldás hivatkoz hosszútáv biztos valamer változ dolg péld szemléltetv feudalist állam jogren alap király császár egyeduralm nyilv keretből kilépv változás elérn remélhetőleg magyarország visszaáll közeljövő humánus jólét társadal orientál demokrác mostan pártáll végtel korrupció gyűlöletkampány peac,Tao_Dragon,7,1632656074,pvs3y5,45
5121,hebm64x,dobrev dobrev dobrev dobrev dobrev dobrev dobrev dobrev dobrev dobrev dobrev dobrev dobrev dobrev dobrev dobrev dobrev dobrev dobrev dobrev dobrev dobrev dobrev dobrev dobrev dobrev dobrev dobrev dobrev dobrev dobrev dobrev dobrev dobrev dobrev dobrev dobrev dobrev dobrev dobrev dobrev dobrev dobrev dobrev dobrev dobrev dobrev dobrev dobrev dobrev dobrev dobrev dobrev dobrev dobrev dobrev dobrev dobrev dobrev dobrev,hunumum,182,1632642710,pvoxz1,60
5143,hebdnw5,gyors googl igaz első gondolna kommunikáció anny gyur bács kerüln vállalat részvény elmúl hónap történés tekintv egyáltal meglepő vélemény konkrét igaz jelenleg helyzet válasz gazdaság terrorist nevezt vélemény egyéb szint igaz soros vezető bank hedgefund művel soros behelyettesíthetne kiváncs itth menny ferdítv mekkor futn,zepapa,7,1632636382,pvgg96,44
5157,he9rirw,egyfajt pszichológi trollkodás foolproof valamek hatás mégiscs fideszes troll odamenn rosszhiszemű dobrev szavazn elrett valam bekezdés éles tiltakoz keress racionális gondolkodv értelm racionális robot ember ariely kutatás ajánl különös vizsgálta visszaszorítja mérte puskázás kötelező aláírandó disclaimer vizsgalap becsül tudás dolgoztál spoiler mérte gondolna,szofter,17,1632606732,pvchp9,43
5162,he9t8ed,elhagy csoport sértő elmúl ovbs tapasztalat múlt válaszlehetőség agyalágyult meghagy vállal mellszélesség egyetemist kezdt végigjárt ranglétr hívt barát ismerősö félév azelőt beszélt erőszakos köztet néhány élte közeledés hitt működés vezető degy lényeg azót eltel amúgy piacvezető dolgoz büsz tapasztal hálás ügyfeleimtől rengeteg köszönet nemhogy ügyfel szint keres ideg ember ügyfel hivatkozv,szofter,13,1632607541,pvau61,51
5174,he9ei69,választás sincs mármin nyilv ember anny járatos polit ellenzéki választan tudj igaz szavazás szavaz fidesz muszály minden rohann előválasztan felmerül szavazn dobrev nyerj érdekel előválasztás elrángatn figyu érdekel tegyél ikszex mzpre kedv csalás szavazzonn szavazz belátás megfelelő barát beszélv menj mzpre szavazn tudt érdekl polit szerencs sikerül lebeszéln elmenn szavazn biztos szavazv vall minden meggyőződésből szavazz,ubiquitin_ligase,-1,1632600802,pv9s2t,56
5192,he7ylwk,több folyamat alapítvány szervezés folyamatos csök állam vagy mérte fidesz ellop nevetséges precedens nélkül osztogatás orbáne készül belekezden lekenyerezze választó választás mindez esetleg mindez képes elveszíten választás mérg vehetsz kurv cent államkassz hagyn kivéreztet ország effektív kormányozhatatlan fidesz ellenzékből mondhat megmondt kormányozn miköz minyon feléget ország egyéb mzp nyom utal dolg tegnap,asraac,11,1632577465,pv6ou2,52
5215,he9b9dp,kisváros szerd középkorú aláírás gyűjten mond bocs továbbmegy lejjebb önkormányzat lakás nyitot hall megy duruzsolás mamapapagyerek kapu írja papír követő pént délut ugran valahov pereputty megy duruzsolás mond akar rosszindulatú megjöt zsák krumpl hazajött közl feleség jött aláírás gyűjten felmerül aláíratja papír bemondja millió állampolgár millió írta,LatkaXtreme,12,1632599353,pv60v7,47
5237,he7qwnl,mond momentumos csávó támadja comment… lakás hivatalos anon onlin árverés megteh hónap kilakoltatta tulaj akiről amúgy tudot semm rájöt lelakot ótvarabb állapot lakás gondolt anny pénz megfelelő felújíts eladt drágáb ment ingatlanárak… komoly vizsgálat kívánó dolog bazd piac szabály játszv profit szokatl ügyeskedésbőlurambátya rendszerből vizsgálat indíts emiat légyszi…,Rossart,257,1632573565,pv4aqr,48
5264,he7d2n8,nyilv form faszság ugyn bőven gond vakcin hianyzot oltás vizsgálat engedélyeztetés kapcsolatos transzparenc idős amúgy kétséges megbízhatóságú klini vizsgálat tesztelte nagyrész idős utólag kiderül való idős jelentős szazalékánal termelőd antites hulla megért costbenef arany emberélet menthetet tudn engedélyeztetés eljárás magyarorszag gyógyszerész szakm szembeköpés utólag hulla idős hallot probléma hazugsag eltitkolás propagand adatt harmad,Zabalint,8,1632564287,pv30kr,53
5318,he71y7q,tesztelt beállítás engedélyezt kamer mikrofon elindított csevegő alkalmazás skype szint beállítás engedélyezt megjelen böngésző kérdezz bekapcsolv kamer akar telefon intézt szavazás perc asztal webkam próbálgatt személy menny látható odatart rakt olvasn homályos átlagos kamerás telef oldan hívot operátor figyelmeztetés letöltv jits opció képernyő letölt webenböngésző indít mosolyogt egymás,kommerszvodka,2,1632555317,putwoz,48
5402,he307nc,tldr nagyszabású ingatlanelidegenítés csomag kezdeményezet főváros kerül fideszes vezetés javaslat összes milliár forintny ingatlanvagyon szabadítja belváros eladás eset kerület ellenze képviselő illetékes szakbizottság kezdeményezte kapta eladás szánde indokló alátámasztó információ csütört szentgyörgyvölgy péter fideszes polgármester szerett kerület testület ülés vinn eladás érdekes problém ütközöt fideszes többség ellenze szavazás többség kerül szentgyörgyvölgy szavaztatt testület által vágyot eredmény születet,anthrazithe,5,1632486296,puifen,57
5415,he2t299,"mondot magyarország fiatal csala számos lehetőség anny segítség magyar fiatal szülő megtakarítás tervezhet jövő állam segítség erőből képes lehet mutatot nova katal hozzátév gyermekvállalás kedv igaz házasságkötés kit családtámogatás igyekez közérthető széleskörű tájékoztatás indul családhu aloldal érintett megtalálhat hátter szakértő interjú kérdezzfelel kész kiadvány amely praktikus információ látja édesanya édesapa kísérlet jelleg kórház családbar magyarország babacsomag forrás független bekaphat",deadlift_bruh,109,1632482052,puh1dv,59
5429,he30j68,teljes egyértelmű dolog dobrev enny gyurcsány szokás dicsern szarbol párt gründol tart független teljes felesleges színp maradn hitelesség deficit karrier büdös élet közelebb kormányzás legalábbis választ jelentős rész helyezn politi palett politi emlékezet elot kezdőd dobrev ugyananny exhibicionist jutn jelöltetn basszameg konkret feleség gyurcsány nőként marade esély elmegy ország kész minisztereln,szeredy,7,1632486471,puh10z,51
5462,he2tbcm,hívt mzptől eleg pasas mindenhol mzp gerill festés hívt meeting próbál tudomás venn telefon megy vibrátor figyel hagyn miköz ecsetel dolg client kinyomn tetéz folytonos postalád szórólap kéretl circl mzp rekla reddit fejű pasas mzp értset isten enny túltoln propagand komoly kevesebb pénz idegesí vvvv voteoln,_Ulfhednar_,6,1632482218,pug64a,46
5473,he2njms,hívl összes megjelenő jakab homfób megszólalás mzp korr full fasiszt vallásos többszavazatos rendszer csukló hazudozás websit lehalás kariger tartot hazugság ellenze vicc fogja szavazn gyurcsányn foglamatl gyökér kitalált utazz szavazhass onlin összes adat dk mszp stbnek kurv kedv menn tiszt lelkiismeret gyurcsányn megválasztan büdös gyökér,newreconstruction,20,1632477934,pufkfb,45
5483,he4iifo,szavaz jelöl kifejezett szimpatikus pontosít elev szimpatikus politikus szem létez lehetn tapasztalatl kezdő egyetlenegy progr hallott akarn megoldás keresn magyar polit feketefehér sakkjátszm értelmiség réteg rovás drasztikus lépés lehetn változtatn kollektív néplél alkalmas örül naiv hisz ellenze bárm jójobb irány terelh igazság mindegy közeljövő millió elégedetlenkedn mind oldal,Prestigious_Bank9428,1,1632509951,pufkfb,48
5492,he2jnmg,"probaljat partszimpat alapj szavazn azalapj kihiv eselye nehany jelolt hadhazy toth ellen jambor andras manhalter daniel ellen tord benc ellen szel bernadett hely akar sincs kedv megjegyezni rehó tibor jancs ellen orosz nemeth ellen megy bosz anet sajnos kihiv momentumos annak mzp mucs ellen hajnal miklós komarom piros ellen dorosz tonzor péter ellen csipkés józsef lengyel ellen ungar peter czegledy",halfbloodGS,16,1632474523,pufayo,60
5498,he2q20y,hely főváros jelöltekről valam előválasztás döntse helyett behúz narancs ellentétes négyzet őszint szólv országos szint azonosuln kutyapárt kivév anny mindegy körzet képviselő fideszes remélhetőleg kevesebb értelm érdekel betyárkört talál leváltv szakács szar palacsint fidesz jobb érdekel polit közbesze nyilv nagyrész propagandagépezet áthangol közméd hibás forgó szem kurvaorbánozt semm jobb bevonás politi élet támogat főleg független gyűlölö alapú megbélyegzés mind oldal,Exit727,-3,1632479906,pufayo,60
5503,he2pc3j,úgys változn esély biztos esély változás rászavaz összefosás megíg ingy hiányz program komoly venn mindegy szobás kertes franciaágy szavazz kisebb rossz elmúl működöt eskü érdekel polit mondan polit parizer felcsút ember érzés lealacsonyítana komoly foglalkozn különbség foglalkozhatn akarn vâlasztás megyúcsányjobbvó behozna politi élet gyurcsány végbeléből potyog felmer gyanú ugyanaz szoc születés kérdés válaszolv szavazn előválasztás kutyapár indul,divizio69,-9,1632479358,pufayo,57
5504,he2pzsc,leszarj feddhetetlenség nyilatkozat kariger megmutathatt ehelyet lanchidbol kilop milliar letez busz lebukot tocsanal elsumakolj muty kapt esely bizonyitan bizonyitott azer lopt tobb akart tudt lehetoseg adsz nagyjabol egyetert definic normalis orszag dobrev cserelt eves kariger gyurcsany vegigjar parbesz jakab regot tartot felkuzden fegyor sehol,RLathor81,-10,1632479858,pufayo,44
5535,he2ow3c,miut ország egyéb évtizedes távlat irreverzibilis hazaáruló germanizmus megbaszódv figyelj lölő üzlet ajánlat pályáz milliár kettő garantál kedvező tribológi viszony visz hatvankettő plusz pályázat vigaszdíj megcsináltat jobbágy alvállalkozó nemgazdaságibevándorló egész utóbbi mehet szállod úgys tudn semm tenn ellen vargáe kerekítés biztos örüln philipp pereln megtöm éhes száj megbeszél dobj telefon,EnragedAxolotl,1,1632479016,pueodi,50
5545,he2i161,tyhű komment olvasv ember tévképzet lesúly demokrác pallos liberalizmus oltár áldoz tollvonás hely világ rend megnyer előválasztás automatic váltv fidesz fidesznyalonc gyengít erőinketerősít jelenleg hatal mond szimpatizál jelölt mindegy nyer egyszerű hidg hagy politikaez szavazás meges nyilv megy szavazn pittyog asszony mzp nyer kijár faszkorbács hüly elítélendő dolog,CMDR_Flash,13,1632472998,pue2hp,48
5597,he2bu9v,konkrétu rossz gondol gond magyar vasú látványberuházás ember alkal használ láss történ rendszeres vonatkozó plán megy akar bzket festen áthúzn ülés nagyszabású fejlesztés rész csomó vonal vágány értelmes menetren összerakn elavul technológ munkaerőhiány megbízhatatl rendszer zsúfol volánjárat közl vonat párhuzamos képtel megoldan település segg vasútállomás város szél kilométer sáros bekötőút hallan valam alagú nyugat,north_bright,5,1632467451,pu5cfk,54
5623,hdzqles,mostan menny szar idehaz tanár szarabb forrás tanár fizetés emelés életszerűtl láss mekkora tanár fizetés ország dollár brazíl siker lekörözn mexikó törökország fényév összes régiós tagáll tanár fizetés tudatos elinflálás minimálbér kötés mindjár minimálbér kifejeződés rezs közoktatás tudás megvet érdekl egyház passzol kell kiművel emberfő pénz csemeté oktatás rádob cinikus vállrándítás jártat bérekből lopn,szeredy,39,1632420572,pu12we,54
5627,hdztn6c,közgazdászkodj mélységes egyetért tanár helyzet tragikus felháborí kormány cinikusság embertelenség perc vitat graf pontatl azonos átlagos árszínvonal brazil luxemburg ugyanaz dollár terme tudsz venn brazil mond norvég feleanny adat korrigálás szorul pontosabb összehasonlíthatóbb szám kapj kétl korrigál adat ment tragikus amúgy,Vitruvius_Corvinus,30,1632421835,pu12we,41
5635,he0h9g7,fideszes mszps toll menőzt tudt szül szavazt biztos fiatal ismerősö szint család kedvel fidesz szavazn biztos igaz tipikus példá ember politikailag null tudás rendelkez gondolja élet tudás bölcsesség megfogad ősei tanács összesség normális segítőkész ember informat hatalmas tudás biztos ismeret elsajátítás járul oktatás rendszer,zemmerich,14,1632432118,pu0tvk,44
5680,hdzc5ky,legtöb szavazna dobrev protes szavazó lenne szomorú tény ország politikailag enny kitermeln mindez idősz közelmúlt iparág állítot kutya küszöbátlépés egyéb racionális esély koalíció boml leszű párt dobrev személy legkevésb elfogadható alternatív összefogás preferál jelölt egyéb bejutn kijelentette ellenze kampány ötletes akció gyurcsányn győzelm szükség bejuss,cuh8todzsugi,4,1632414656,ptwu8j,45
5750,hdyg1d0,böngész politi megosztv amúgy javasl hogyh köves magyar sajtó erős kormány manipulál csatorna újságos kormánypárt találsz ajánl telex anny erős kormánykritikus portál megnézhet művelt párt elmúl idősz amúgy kösz érdeklődsz iránt hasznos szeret szavazat sajnos magyar fiatal állampolgár álláspont érdekel követ mindegy legyél ellenpéld,cass3zoe3ngonk3,17,1632400332,ptszmm,44
5769,he2algd,emel segg irány szavazn szavazn állandó lakcím kmre tartózkodás helyemtől szombat járt otth szavazn leállás onlin szavazn nincs webkamera amúgy szeretne személyes szerett meghirdetet időpont lehetőség egyéb mindegy nyer előválasztás lényeg orbáne szop gyurcsány beleszarn zsák indítana ellenze szavazne lopn ellenze vállalhatatl figura ugyanúgy haver visz állam tender egyszó ismétl nyern ellenze valószínűleg siker megakadályozn kics kevésb szar,bandi2289,1,1632466424,pts4ou,58
5770,hdysw8p,bátya sógornő elment szavazn voksolás jött idéz elment leadn voks előválasztás fontos tart vezet ellenze magyarország sátor előírja lakcímkárty személy megjelent megfelelő hely szembesült szavazn feltétel támogat közös ellenze list jövő választás felháborító antidemokratikus etikátl lépés csalódot dühös jött szavazás anél beleszólt végeredmény,TearSlayerr,-8,1632406535,pts4ou,43
5877,hdvg0dj,ugyanez mármin elkrt csinálhatot ellenze rövidfil gyurcsány hiba kezdőd öszöd besze tüntetés felépít kezdet siker boldog ünnepl győzelm kétségbeesettebb ember kider elszámoltatás nyugdíj kórház iskola ugyanúgy csala barát gazdag kiálln vita beszéln tömeg kormány provokál lejáratókampány nyom egész tanulság elkúrt hitt szavazó nyomatn reklám youtub féligmed megtévesztv eredet kíváncsi legtöb venne hülye észrevegye korrupció gyűlöletpolit,gyurcsany_viktor,42,1632334270,pt7z4z,55
5901,hdu5jlm,ráhajt legnépszerűtlenebb komment kiszámított halmozot infláció évent átlagos kurv elszabadul infláció valamenny manipulációs fogyasztó kosár történő variálás eköz záróárfolyam változot szorzat csökken forint kapot fizetés érte bruttó átlagkeres nőtt megtalált leszámítv populist fideszes maszlag mondanivaló hely összehasonlítás tészt nézz gyurcsánye flott működő gazdaság hagyt,megfog6od,-2,1632314361,pt5ci7,44
5931,hdtt8ig,visszamenőleges hatályú jogalkotás tilalm fontos jogállam alapelv betartja hozhat jogszabály papír legális ügylet utólag törvénytelen lehetn minősíthető csíp túlzott schiffer andrás párszor ellenze üres lózung puffogt dőlnek kampány jogáll megvalósíthatatl antidemokratikus hazugság populist géppus felcsút fegyőr hadház konkr tény dokumentum haragsz ellenze jobb höhö dk mszp,catsdorimjobs,12,1632306135,pt3te0,46
5951,hdtn0uz,elfeledkez folyamat ellenze párt kompromisszum kötn engedmény tenn választó tart közös jelölt mindenhol miniszterelnökjelöl keménymagos szavazó bukn olyan keves érdekel demokratikus foly eredmény jelöl dobrev jakab akár besértő biztos érdekeln fidesz malm hajtja ellenze veszí fogja okoln favorit indul ment szavazn igaz,north_bright,25,1632300362,pt22i5,42
6001,hdtqbq1,enged faszság jelenleg legjob legkézenfekvőb működő alternatív mostan forgal infrastrukrú felgyorsítás fluidab tétel népnevelés edukáció lehetetleníthet autósforgal kizárólag idegesebb feszültebb ember kevesebb autó ugyanot menn beszélv fogyasztás fordul nyektetés félreértés esse szeretne legjob belváros élhető hely akárhol kevesebb emisszió kevesebb autós megtörténn megvalósuln,CMDR_Flash,4,1632303525,psoe88,43
6020,hduqtvk,személyes szavazt márky gyömrő flott mondan korosztály szavazn cool dolog lust gondolj beleszar egész zsolt kopaszoszt fogja eldönten jövő magyarország cenzúrázot tikt kizárólag szórakozó hely kinyírja alter zenekar fellépés vern kinézet tömegtől tiltólist videojáték besorolás terület pofázn éljez fiatal gondol szeretn,Signal_Hamster6245,0,1632324062,psnp4z,41
