,comment_id,text,author,upvotes,timestamp,post_id,lens
2562,hflycfr,komoly mond szavazz masod fordul gondol fordul mzpre szavazt azot hulyeseg csinal igaz kezdv eredmeny napj kitet fbra latogatot hang nezt komment alapj vallasos negativ kommen szedt gyerek kampanyol vallas hats erdekel hisz tarts fszmericskeles kgvel meggondolatl kapkodas lejaratj dobrevezes anny kisstilu amator viselkedes szegyell fajdalmas nezn,Atrombit1975,35,1633531632,q2jniz,47
2583,hflhpu4,kedves péter szavazó egyértelmű kimondta karácsony gergely dobrev klár szíveseb látna miniszterelnökjelölt pozíció egyetért kérdés alkalmasabb jelölt gondol szempont karácsony gergely vélemény méltatl helyzet hozz sugall visszalépn egyértelmű esélyesebb jelöl visszalépn maximu közös érdek nézz ellenze polit vezéral lejáratás elérn amenny folytat jelleg kommunikáció karácsony helyez terh kérdés veszíten tudn lépj vállal nyíl verseny jelöl megalapozatl önbizalm közös esély ront,Tomieez,13,1633523634,q2j9mf,60
2589,hflh7ef,ember akar zugló polgármester ember akar főpolgármester ember akar miniszterelnökjelöl ember elkez hadováln hatalomtechn éles bírálv sebt összerántot sajtótájékoztató mond visszalépn akar kormányváltás április vastag kenn leszar mostmár egész anny idiót trón harc színfal játssza kíváncs tisztel hölgy képzel koalíciós kormányzás pontos lényeg hasonló játszmázás végezze bizonytalan polit csalódott tábor erősít reflex működ kivárn eltűn baszódjat,szeredy,79,1633523327,q2j7rd,56
2594,hflmart,"karácsony számí miniszterelnökjelöl dobrev legyen márkizay egyetért szövetkezzünk karácsony számí miniszterelnökjelöl mondane elütn villamos márkizay egyetért kormányelrántós játszunk karácsony számí miniszterelnökjelöl legjobb elfogadottság felmérés márkizay egyetért felmérés karácsony akar egókérdés csináln amúgy számí miniszterelnökjelöl alkalmas jelölt eköz dobrev ferike viselt narancs színű szopóálarc álln",Volgild,12,1633526101,q2j7rd,44
2632,hfljhgg,megnézt fasz bejelentett beszél semmiről kimagyarázz visszalép jelent amúgy rúgot mzpbe felesleges szövetség egyetértés amiről szint eset mzp legnagyobb szövetséges amúgy szavazó akar győzni dobrev gyakorlatilag lerohadtfideszesezt mzpt burkolt rész indokolatlan rájöt mzp visszalép úgyhogy köphet felrúhgat tegnapelőtt megállapodás úgys egyéb mzp rúgdosás mondanivaló nagyrész szimpatikus mondot,PJohn3,4,1633524634,q2imrc,47
2647,hflk1mg,fidesz frakció európ parlamen baloldal többség ismételt kiforg fontos kinyilatkoztatás szorgalmaz politi eszköz tekin gyermek elkövetet erősz vívot harc valós cselekvés terv hely jógyakorlat befogadás öööö fasz jelen egyáltal baloldal többségű európ parlamen hangz gram gram emelt csokola fejadag eppecr tömb bőven kényelmes többség sdzöldngl tömb renew baloldal sorol szab elhinn gyer kérdez,Siorac,9,1633524931,q2i11y,53
2698,hfkv6gk,bevállal népszerű kördiagr mértékegység arány ábrázoln jelöl arány ábrázolta mértékegység tűnhet nyilv kördiagram hisz ábrázol mértékegység summ alapvető teljes szabályos kördiagr jelöl begyűjtöt százalékegység ábrázol gondoljat jelöl egységny szavaz szétosztv összesség tekint ellentét oszlopdiagr mzp osztot teljes szabálytal egyértelmű manipulál vizualizálás disclaimer mzpre szavazt forduló szer mzp elismert dolg törölt kitet javított köszön,ticolon505,52,1633505605,q2f42q,53
2742,hfiy9e4,listás mandátum elev kevesebb egyén listás nemzetiség képviselő listás szavazat osztja egyén körzet vesztes jelölt leadot összes szavaz győztes jelölt leadot többletszavazat beleszámít amenny több kapot hacs szavaz nyer egyén ellenze jelölt szavazol automatikus leadsz szavazat ellenze list bűntudat érezn rendes listás szavazat kutya,szofter,-1,1633467726,q24ass,44
2748,hfiqhur,kapcs kerd biztos targyalv temabel posz osszes hozzaszolas sajnos csekkoln gyors profilozas szep valakitol karacsony masod dobrev behuz valasztopolgar szemelyiseg dontes hatt erdekel mier voksoln illet olvasn karacsony esetleges visszalepes kapcs ervken tippmixes matematikus szamolt fogalomtartomany lelektanilag valasztas programilag koszon segitseg magamtol sajnos alap dolog,vadifuk,3,1633464442,q23x7a,45
2751,hfkmead,kérdezet valószínűleg képvisel vélemény anny szavazt karácsony fasz kompetens vezető tartana mindenfél háttérmegállapodás paktum izébize valahogy szavazólap márp szeretne agresszív félelemkeltés lejáratás full kamu kurvadrág álhír operáló bunkokrác megszűnn cinikus vigyorogvahazudozó korrup mocsk kapn valam nyak kvázirendszerenkívül alternatív valamenny szimpatikus markizay szavazne kényszerűségből,Rossdaemon,54,1633498487,q23tcm,43
2753,hfj0517,valószínűleg reprezentatív kutatás amiből párszáz mondja rész venn forduló adat vesz rész való összetételű sokaság alulreprezentált társadalm csoport párt szavazó ennélfogv semm kikövetkeztetn kutatás hibahatár esetleg mérn jelöl szavazn rendes választás fidesz összefogás mkkp haza nagy torzíthat jelölt ismertség fennálló különbség dobrev karácsony ismer márkizay eleg hallot többség,RenesansJG,36,1633468546,q23tcm,48
2795,hfh70d5,rajonn basszameg horogkereszt fasz belerajzoln tort gimnazistaken teljes bazdmeg igazabol mesterszakos diplom csinalt minden meges bebasz kurv dolg ember idiot fiatalabb valamier nyilvanos szoptatas valamier elmul megjavult kibaszot karlendites jobb tenyleg donten szar akar jobboldal intelligens ellenzekiseg durv kihuzt alol mzp,Lil-Andrew,8,1633440924,q1uuk5,41
2836,hfgmpsz,helyz jakab igaz karácsony mzp túllőt kevern szar szavazólapos civil kivert biztosíte hergel dk tűni lenéz szavazó legnépszerűbb ellenze párt képvisel dobrev kommunikálhat dönts választó szimpatikusabb ezerszer elismétel dkdobrev veszíten karácsonye morális fölény gyors visszalépésről dknak jakab igaz szövetség választás kavarás jelenten visszalépés vetn cirkusz,Vektor_,6,1633427890,q1srk7,45
2886,hfgcsny,elmon helyzetrol jozsefvaros csokken hajlektalan szam emellet anny rendpart boton egesz narrativ amiot ellenz vezetesu megy lefe sullyeszt leggazabb jakab peter idejot demeter mart promoanyag csinaln drogosszemetes keruletrol demeter kapot bazmeg nyolcker jelentos munkasosztaly szegenyreteg tovabb szarv elmul elmul eredmeny anny corv negyedbol ingatlanbefektetes penzmos csinalt arab uzletember ures lakas polit csinaln lehetn elvegezn evtiz minimu,halfbloodGS,54,1633418227,q1opi5,56
2893,hfggy8e,értelmez törvény érte temet összefogás választás siker aratot takti szavazás párt rájött nagy választókörzet múln törvény ugyanígy összefoghatn tarthatn előválasztás körzet mindenhol erős jelöl fidesz választás list indul párt maradh választókörzet legerősebb list stratég szavazás extr nagy választó kényszerítv fideszes körzet képviselő versenyz egymás jobb dk mszp ellenze szavazó különbség list párt szavazn felkavarodot kisebb szartornádó miniszterelnökjelöl,nthai,6,1633422267,q1hf7u,57
2940,hfdcne4,telex downdetector problém világ fennáll legtöbb felhasználó számítógép böngészv „server error üzenet applikáció tovább működ friss poszt tölt interakció basszus foglal többszáz megabájt telef tároló gyorsítótár ment csomó tartal jelent megnyíl megnyitás betöltöt poszt tölt mégegyszer hely tároló jelenít egyáltal intern valam régebb pillanatkép,marcabru,8,1633366600,q189lo,44
2943,hfe4ynw,családtámogatás rendszer megtartás esetleges egykulcsos klárakét anny hallott pokol pöcegödör ember hülye olvas progr bezzeg literális neolib daddy behúzot minden tiszt hazud miköz feles alkotmányozás ugyanúgy bullsh kiderül fodor gábor polit kedvenc szakértőz bízó ember hadházy bízt elszámoltatás szakértő szakértő tudna hadházy állatorvos jogász nyomozó kiváló pozíció betöltés gyerek politi kinevezés szakértő,halfbloodGS,7,1633377081,q17i9b,52
2947,hfcxwgs,karácsony ígért dönten minden kezdeményezn fogja országos választás bizottság szavazólap márkizay mindegy kormányfő helyettes közös dolgozn márkizay garantáln fogja alkotmány garantál diktatúr hozhass márkizay kormányváltás hadházy ákos vezetés zajl elszámoltatás korrupcióellenesség családtámogatás rendszer megtartás megegyezt kiáll határ magyar megegyezt személy döntés egyetért kormány videó,mru576,84,1633360676,q17gxq,44
2962,hfd0888,karácsony ígért dönten minden kezdeményezn fogja országos választás bizottság szavazólap necces amer választás szavazólap aleln jelöl szavazólap előválasztás lényeg ellenze beállj jelöl vben meccseln remélhetőleg választás nyer mindhat igaz kihívó igaz ellenze oevb hely döntene mejelöl szerepelh szavazólap egyéb veszélyes mzpkarácsony dobrev köth alku jakab helyettesjelölt szavazólap elvég jelölt helyettesjelölt máris jönn jobbikos szavazat dobrev vide eldöntv forduló,Vektor_,-11,1633361692,q17gxq,58
2991,hfch4dl,következő taktikázás jakab akar oldal álln következő kariger mzp oldal valamely visszalép dobreve képviselő nyer legtöbb egyén egyén szerzet létszám dk jobb helyzet akadályozh dolg jakab fontos dobrev oldal egyrész szavazó tökéletes ráfest fidesz szajkóz gyurcsány csicská másrész klára elbu fidesz esélyes megszopt,Tnil_1,48,1633352731,q14hw2,43
3001,hfcgm2g,nehéz szitu dobrev bizony kgnek esély kizár mzp tudna győzni kíváncs függetl kutatás eredmény rész alapozza végső döntés esélyes mzp vezetés esély menj biztos dobrev esély fidesz nyer kockáztass esetleges fidesz cser lever gyurcsány gang sansz fuss megoldás feltesz által megrendel kutatás esély kitér felelős döntés hozn feladat bárm felállás támogass szavazz,kiszol,22,1633352452,q147i6,52
3013,hfcxrmv,hadházy ákos momentummm igazságügy miniszter jobb jogász végzetségű ember hadházy kapj korrupcióellenes bizottság ilyesm dobrev dk külügyminiszter vicc rossz feketegyőr andrás momentu oktatás kulturális miniszter kunhalm ágnes mszp szociális munkaügy miniszter leghülyébb ember parlament keresnivaló kormány szél bernadet momentu környezetvédelm vízügy miniszter mérn látne sötétző,HouoinKyouma007,1,1633360616,q14222,45
3030,hfcb4f6,valamelyes hasonszőrű bíztatnál hatalompolit tévesz értékalapú politizálás állatorvos bemutatn kdnpt verseny kasszakulcs megy tűzi zászló szavazz legjobb arány remél közpénz közhatal közcélúmagáncélú felhasználás lelkiismeretes politikus bocsa párt leginkább hangsúly változás esély érték kerül előtér egyegy kormány érdemes figyeln érdemes elfelejten választás marketingháború szavazat,wzv4t4,9,1633349160,q13nn6,43
3078,hfbmmaj,kilyukaszt bubore szól előválasztásösszefogás ország teljhatalmú mzp nyern kormány dobrev dk legnagyobb frakció mzp beüln kariger párt frakció frakció pártpoliti ráadás rossz helyzet hívja összefogás sajnos félreértett lényeg világkép mzp árult ország belépet összefogás ahelyet indul való ismer választás rendszer társadalm realitás esély elinduln valamer mzp összefogás promótált mzp kommen meghas szív,ticolon505,128,1633328516,q0zrtt,52
3086,hfbw3r7,erős fideszellenes legtöbb kommenter alapvető minden menn bárm teljes érthető összefogáspárti típusú komment lepőd ember leszavaz pedofil gyerekgyilkos takarodj nyilv minden eldönten nyilvánvaló előtt bukot elit sikerül teljes restauráln hatalm ellenze sikerül tematizáln közbesze véletl tenn kérdés érdemes hatal juttatn egyszer bukot politi elit termelt exneonác band fidesz következő fideszbérencezv,SimpForSowell,4,1633336926,q0zrtt,50
3127,hf92n3w,forog gyomr dolog tesó kizárt polit folyamatos bohóckodás megy csinál folyamatos anyag érdek foglalkoz megy mutogatás mocskolás szánalmas komoly anny triggerel kedv puccs csinálj megválasztass magyarország kormányzó rakj ország legszebb legokosabb gerinc dolg lehetn ország csináln herdálv pénz propagand szarház kapj lehetőség élősködj ország pofátlan erkölcstelen hazudoz próbál kivonn polit bics kinyíl zseb basszameg,zenit5GG,19,1633283965,q0mid4,54
3132,hfbuac8,sajnos youtub oldal teljes megy pihol sehol rekla készülék csatlakoz mondt ytra leglább máshol lőni blac listeln gyöker reklám egyéb ajánl ncor tölts gyer mese mondóka film zene játsz tvre tool átkülden tartalm gépedről tvdre lenn isten teljes iktatn szar reklám sajnos tipp,_Ulfhednar_,2,1633335239,q0mid4,43
3169,hf8g7mw,egyéb mzp vitat forduló esélyesebb esélyesebb kérdés menny hozható magabiztos forduló mzpvel emeszpés mögött balos átszavazhat klár jobb látható lapí utóbb egyéb szívfájdalm mzpnek hitt jobb beáll jobboldal durv fegyvertény sajnos jobb lapí sajnos politi realitás mzp forduló kockáz csinál közös progr kampányol végső kurv mindegy optimálisabb opció matekozza által emlegetet jövő kutatás faszméreget hájpolja szavazó,ticolon505,55,1633274453,q0jf8v,56
3202,hf7tvx1,megakar szólítan mzp fegyőr jakab szavazó előtt világ komoly vesz feltétlen előtt tevékenység zugló polgármesterség alatt tartózkodós félrenézős taktiká valahogy tudna kinézn előtt világ elszámoltatn félrenézn közös mzp agresszívabb nekiesn támogató párt gyors következő medgyessy reál sajnos előtt elszámoltatás engedn félelm után hacs törvény tartotta,Peti1899,21,1633263110,q0gesp,45
3224,hf86i69,rész lopot pénz megvalósítás marade fogható pénz rész offsh számla bankrendszer szövevényes folyosó vész lölő sikkasztott feltúr vagyon talál másodsor lecsorog rendszer megszűrőd hisz beszélt milliárdos nagyságrendű csalás végfelhasználó részes sokad sokad harmadrész kivitelezés rész dolog megépül vasú prémiu nyaraló tokaj borvide utóbb ugyanúgy ugyanaz pénz tenn akármenny szeretne érvényesülh szomorú szar akármenny szeretne elvet pénz visszatéríten akadályozn több,CMDR_Flash,3,1633269983,q0ez9p,59
3229,hf9g9ow,teljes igaz mond kormány gazdaságikulturálisértelmiség holdudv politikus ésvagy rokon gazdaság érdekeltség kormány lobb mindmin etetn egymás követő kormány csinálja hatal átcsatornáz ember tesz túlárazv minőség határidő végezv közelebb álló lobbizó kapn elvégzés visszaszerezn akar akar nézn akar visszaszerezn akar visszaszerezn enny álnaiv kizárólag oszthat befolyó pénz kezelhet meglévő vagyon egyedül dolog tényleges verseny,HunSoc,0,1633289460,q0ez9p,53
3255,hf79gz1,militáns hangul röhejes rendőrterror feheroroszország sitt vágja ellenz újsagír gazdaságijog terror látványos bemutatn vagn verző fejű tüntetőkről szánkó parlamen gonosz diktátor eltüzelt összes magyar gyer szánkó hazug propagand szar akár csinál felcsu kisvasu stad főni kert vegéből kastély lady helikopterleszálló,catsdorimjobs,8,1633248362,q0cuy2,40
3259,hf5xytp,anny mondot alsz nyilv kamu hallott hasonló kaliberű asszony sikeresség keves alsz dolgoz igaz talál bizonyíte boldogtalanság jelző szokta mondan beér anny kenyer szolgált tető boldog élet gondolkodn tenn jólét viktor ugyanilyen mutat felcsút éldegél család szerény körülmény farh pörkölt zabálv,gyurcsany_viktor,48,1633220967,q04acl,41
3260,hf745nq,drág autó kedvenc megvett vitar hitel szomszéd orvos lizingel mercedes lentebb igazgatoasszony megvett hitel hatosmaz haver szint lizing hozt szem szomszéd amer dolgoz autó birtokos lizingel hitel gyár kocs mitagadas eleg szép mustang bemen kereskedes kpra accor több hagyt összeg kpra drág autó tulajdonos önerő gyan megsincs drág autó weir,Padawan180,36,1633244179,q04acl,50
3262,hf75dng,mult debrecen fideszes tolten kerdoiv mond velemeny varosrol ujranyitasrol gondolt tiszt lelkiismeret kilometeres szoveg arrol varos amugy tenyleg odament aktivist fotozkodas rendezodt latt odamegy hell pillan mindjar megy szart mond azer megvar erdekel nehez kapt fotos gyer csinalj elkuldt pics biztos beszelgetn kedv biztos kitoltot egybol daral amin elkezdt olvasn,Styrol,12,1633245145,q04acl,50
3275,hf59rwl,nyern rendszerváltó politi fideszmszpd komcs káder eltakar magyar lakosság elkez felelősségteljes tudatos döntés hozn lehess egyszer kifizetésekkelhitelekkelkrumpl lekenyerezn láss cukormáz mzp fény tűni magyar polit sötétség nagyapa szav korp kevered megesz disznó vezérelhet legnemesebb szánde körülvevő politikus nyak korrupció mocs független lehetőség elinduln jobb irány megmoz tömeg,KG3ry,33,1633210178,q01wpi,47
3283,hf58ck0,hinne esély politikus elrug labd esély rehabilitáln siker megtesz dk fidesz kisebb anny elvakul szekt kormány mond dk hitt előválasztás elküld szavaz szétoszl kics dobrev forduló nyer ismerős stratég ezres részvétel könny pletyka játe kerülhet egyértelmű dk malm hajtana hisz véletl következtetés anny karácsony márkizay beleszarn kész leves tudatos mégs dobrev kormány dk jobb dk álln megtehet jakab jobb harangozt,_adam_p,18,1633209553,q00x0t,60
3320,hf3ef2h,csab faszság beszél parlamentáris demokrác dolog kimondott minisztereln jogkö parlament miniszter kijelölés tartoz valahogy fogalmaz alaptörvény javaslat tesz miniszter személy köztársaság nevez parlament közjogilag szerep minisztereln feladat politi realitás nyilv parlamen szavaz bizal kormány párt érdem beleszólás kormány személy összeállítás okos miniszterelnökjelöl egyezt támogató koalíció párt orbánizmus folytatás pártkatona akarsz minisztérium rakn orbánizmus ellentét,szofter,24,1633180268,pzu78o,54
3343,hf2znfb,pillanat komoly akar beszéln elvonatkoztat gyurcsány mindentől nézz képvisel dobrev büdös semm konkrét politikus eladot ügyn ígérgetés nagymest konkr dolg képtel kijelenten politi szabó péter érzés játsz képvisel érte tényelg ember ország kulcs beszél tanárnénis stílus nézz mosolygás antipuzsér stílus számí tartal dk erős ember benyal szám legnagyobb csalódás tényleges megmutat ország értelm érzelm színvonal,Sea_While2463,16,1633170797,pzs3wi,55
3351,hf33ypl,csepel váladztás választàs erősebb fidesz kőbány hasonló hagyományos balos rozsdaövezet hasonló helyz dobrev hely nyert vide rész karácsony hely nyer elev erős erősebb ellenze magas jövedelmű polgárias terület belváros pest agglomeráció hely szavazó rész komoly problémá dobrev egyéni nagyrész szimpatikus momentumospárbeszédes jelölt nyert szint szavazn dobrev tudna fordítan baloldal gyengülés rozsdaövezet vide,markg128,-1,1633174028,pzs3wi,52
3356,hf2zok2,kormánypárt cukrászd ellenze cukrászd kormánypárt narancsos tort megszokta ember bemegy ellenze cukrászd cukrászmester gyurcsány ferenc összellenze tort dk mazsol mazsol legmegosztóbb élelmiszer állhat mondja mazsolás tort elmen piac megengedhető engedj kormánykritikus szavazó lenyom mazsolás tort megoldás jakab pékmester tort mazsol jakab február tűni jakab pékmester akar letoln gyurcsánymazsolás tort,szofter,58,1633170822,pzrsee,49
3427,hf0f00l,delboscorfiel személy nevezt kifejezett ellenséges állt delegáció találkozás képviselő „vicc nevezt megbeszélés feláll távozot bíró megfenyegett bíróság megsértés vádolt varg pint kérdezte pegasus kitért válasz delegációvezető pegasusügy vízválasztó egyértelmű mutat kormány rendelt megfigyelés rákérdezet közméd ellenze aránytalan műsoridő médiatanács válasz biztosítan feladat,mru576,42,1633116725,pzfb58,42
3462,hezcot8,tldr döntötte valamely biztos lépn hétfő foly leír ideális legsikeresebb innentől személy vinne választás deklarált minisztereln helyettes nyilatkozn plakát megjelenn tudna kimaxoln szavazó leadot voks mindegy mely országos listás hely hely megjelenn kampánycsapat hangoln mindkettő erős csapat hajra súly mehelyettesség csinálj deklaráln megerősít pozíció hatáskör jelentse videó mzp karácsony epic handsh keret,Horny_Humplar,382,1633100155,pz9c8s,52
3489,hez58rw,mondt kérdés mzp puzsér díjas lesz érts megegyezn karácsony elin harmad következő látsz jutot helyzetről puzsér csináln mzp hely puzsér mzpt intelligens ember tart dobrevből győztes csináln előválasztás ellenze összefogás vesztes csináln remél csalód örülne karácsony lépn mindkettő helyezett haragudn,Zabalint,12,1633096807,pz7qwv,40
3496,hf05936,puzs bizonyos tekintet igaz zsigerből lehord véres bábú rohadt alkalmas mond bárm puzsér kocsm kurvaanyázó alkoholist evolválódot verzió anny vitt élet utál élet munká gyáv kockázat vállalj több vigy igaz borzasztó toxikus mindamellet hajra mzp tenn fideszes szavazó kormánypárt magyarázn mondt hülyeség,DcNdrew,2,1633112471,pz7qwv,42
3511,heywfxq,kezd rémisztő elmenn rossz irány mostmár mzp csúny rossz hihetetl mentális gimnaszt nyom egyes dolg lehúzz minden amier mzpt dícsér mzp választás visszalépn kariger mégsincs kedv visszalépn hatalomvágyó szarkupac nevetséges ember komoly elvárja helyezet lépj állj pillanat esetleg rájöv menny nevetséges,onewiththecake,6,1633092420,pz72on,41
3521,heyvx5a,meglepő összegző fegyőr bírt szállj egyéb dobrev mzp eset látsz menny fontos vide utóbb hamarabb kezdt partiz interjú környe lépet enny tudt hozn dolg fidesz kezdet nagy menn jött polgár hasonló vide szervezkedés kariger nevéből jutot ahov kettő sajnos őszint remél mzp karácsony momentu egyezn elnyer oldal szavazó támogatás belátja szab hagyn jövő választás dk fémjelezv,makkoshotyka,2,1633092135,pz6ulh,56
3526,heysgvq,vágyál hangz részedről mzpnek összes szavazat húzn jobb momentu láss statisztikailag valószinűtl beszélv szavazot ‘nehéz’ onlin szavazás forduló takti szavazás sincs értelm ismerősö szavazt kedvel másod kgre látja esélyesebb dk viktor legyőzés esély jobb szavazó egyszerű szavazn sorren mzp következő forduló több kapn subredd iszonyatos túlbecsül népszerűség,onewiththecake,11,1633090155,pz5yrw,47
3539,hf008kg,problém dobrev fordulós győzelm jelentős rontana ellenze esély választás problém temet egész fidesz ellenze szavazó idegenít ember előválasztás szem tartan bizony null esély dobrev győzel előválasztás vereség szajkózás abszolú segí elültet gondolat ember elkerget összefogás egyén jelöltektől hagy fidesz ember rémisztgetés független menj forduló szavazn április közös ellenze list jelölt,DressageGuy,6,1633110295,pz5tk1,50
3559,hf00rx5,csakmond olvas csodálatos minőségű city újság adatgyűjtés bábjáte tartja előválasztás karácsony győztes dobrev nyert könyörgö nyerj márkizay hónap kommentál kormány színjáte befu győztes jobboldal konzervatív figu fideszes tudna tisztel orbánkormány remél megalapozottabb értesülés orosz hitel kapcsolat kapcsolat kurv pretty pleas,DcNdrew,5,1633110528,pz5axk,40
3586,heyfkl5,végeredmény alakul dobrev demokratikus koalíció szavaz százale karácsony gergely mszp párbesze szavaz százale márkizay péter magyarország mozgal szavaz százale jakab péter jobb szavaz százale feketegyőr andrás momentu szavaz százale forduló végeredmény habár dobby nyer nagy jelöl körülbel vitt szavazat hajlandóság induló politi alku könny kariger mzp győzelm függ egyez jelölt preferál leginkább választó megmar miniszterelnökjelöl meglát fogalmazás,Tao_Dragon,19,1633080275,pz4c3h,57
3599,heygbw2,felbasz prémiu kifejezés prémiu szokot kapn végz munká munkaadó valam honoráln kíván smegmahurkás fasztbevon nyugdíjprémiu bazmeg özvegy ánuszn kiváló készített qban almáspit kanyarszary bács példás szed ibuprofen megy sztkba tehermentesítv csigaláb doktor özvegy vérbulcsún szintidő képes hazaszállítan csirkefarhát lehelpiac bassz banyata villamos gááh nyugdíjprémiu kurv,klassz,231,1633080979,pz3i8f,45
3603,heymfuz,együgyű hüly korosztály nyomor semm csinál fidesz kevesebb nyögdíj évent csúszt kiló krumpl gondol zsokészagú herezacskó hagy raelvez gyúrcs teljhatalmu ketharmados kormany hüly ember komoly tanult bárm egyértelmű láss ember szándékos tart szar szavazás elvegy perc lélegezz mielőt visszasullyedsz homlokkozep esküszö látja,Dyrreah,37,1633086122,pz3i8f,42
3665,hey8tzn,tagadhat látható ember teljes szar ország sors fontosabb előtér legy bekerül parlament boxzsa magyarország jólét személy hány fidesz propagand gyurcsányozás bazdmeg fasz odapakoln viselkedet bekábszizot minimu lehajtot feles beszél értelm elhagyt kezd hinn megőrül folyamatos fideszes támadás teljes mindegy tehetséges politikus siker megállítan jövő,Icandodgebulletsbaby,91,1633074034,pz19j9,44
3711,hewoufd,valaszonlin magyarhang szerkesztőség cakkumpak fgya bevallás hadhazy mzp állítólag pálinkás gyanús ember hiresebb lukács katal olyanny politi teljesítmény kilépet kdnpböl azót sztárolja édeskevés simics fidesz szavazn ismerős korosztály hitte hinn akart környez visszacsatol belátta fidesz kihasznál hasonló jobboldal szavazó tört,pietro_HUN,24,1633041785,pyueph,40
3713,hey5kn6,barát család rész kategór kétharm fidesz érte feladv elárult kétharm segítette cinikus arrogáns macchiavellist tolvaj korrup szar zsák korább érte hagyv amiből kormányzás képvisel jópár rész schiffer vezett szétesés kutyapár voksgyűjtő márkizay adot remény dk gyurcsány mszp szdsz opció marad orbáne népszerű,lecsic,9,1633071164,pyueph,42
